utterance,utterance_no_specialchar,da_tag,speaker_sex,da_category
"['{d well, } [ how, + how ] do you feel about the  immigration laws? /']",d well   how  how  do you feel about the  immigration laws ,qo,FEMALE,25
"['at, - /']",at  ,%,MALE,5
"['currently, i think they are a little restrictive.    {f uh, } particularly for, {f uh, } certain ethnic groups or from certain countries.  /']",currently i think they are a little restrictive    f uh  particularly for f uh  certain ethnic groups or from certain countries  ,sv,MALE,3
"['{f um, } i think we should permit, {f uh, } more immigration from eastern europe,  for example, {f uh, } particularly [ the, + {f uh, } <inhaling> the ]  jewish, {f uh, } <breathing>, {f uh, } people from russia.  /']",f um  i think we should permit f uh  more immigration from eastern europe  for example f uh  particularly  the  f uh  inhaling the   jewish f uh  breathing f uh  people from russia  ,sv,MALE,3
"['i think we could permit more of them in than we have  permitted in the last, {f uh, } several years.  /']",i think we could permit more of them in than we have  permitted in the last f uh  several years  ,sv,MALE,3
"['{c and, }  i think we  have, {f uh, } {f uh, } too much restriction [ on the, + {f uh, } on the ] orientals also,  /']",c and   i think we  have f uh  f uh  too much restriction  on the  f uh  on the  orientals also  ,sv,MALE,3
"[""{c but, }   of course, that's just my opinion <laughter>. /""]",c but    of course thats just my opinion laughter ,sd,MALE,1
"['yeah,  /']",yeah  ,b,FEMALE,2
"[""{d well, } i'm not real sure why i got this topic,  because i don't think i checked it off on the list --""]",d well  im not real sure why i got this topic  because i dont think i checked it off on the list ,sd,FEMALE,1
['uh-huh. /'],uhhuh ,b,MALE,2
['-- because i know very little about the current immigration    laws. /'], because i know very little about the current immigration    laws ,+,FEMALE,0
['uh-huh.  /'],uhhuh  ,b,MALE,2
"['{d well, } we seem [ to, + {f uh, } to ]  favor certain, {f uh, } {f uh, } countries particularly south american countries.  /']",d well  we seem  to  f uh  to   favor certain f uh  f uh  countries particularly south american countries  ,sv,MALE,3
"['{c and, }  {f uh, } <inhaling>  there is no, {f uh, }   <breathing> {f uh, } - /']",c and   f uh  inhaling  there is no f uh    breathing f uh   ,%,MALE,5
"['i have nothing, of course, against, {f uh, }  [ the, + {f uh, } the ] south americans [ or, + {f uh, } or ] hispanics,  in that sense,  /']",i have nothing of course against f uh    the  f uh  the  south americans  or  f uh  or  hispanics  in that sense  ,sd,MALE,1
"['{c but } i think we, {f uh, } are more restrictive of the, {f uh, } so called eastern, {f uh, }  european countries than [ we, + {f uh, } we ] should be.  /']",c but  i think we f uh  are more restrictive of the f uh  so called eastern f uh   european countries than  we  f uh  we  should be  ,sv,MALE,3
"[""of course, that's from my own bias since  my ancestors from eastern europe,  /""]",of course thats from my own bias since  my ancestors from eastern europe  ,sd,MALE,1
['{c so } <laughter>. -/'],c so  laughter ,%,MALE,5
['oh. /'],oh ,b,FEMALE,2
"['[ {c and, } + {f uh, } {c so } ] i think, {f uh, } {d you know, }  the, {f uh, } embargo we placed [ on the, + {f uh, } on the ] russian jews, although we  ((   ))  [ of, + ] {f uh, }  spent years and years, {f uh, } lobbying for their release and their ability to, {f um, }  immigrate from russia --']", c and   f uh  c so   i think f uh  d you know   the f uh  embargo we placed  on the  f uh  on the  russian jews although we        of   f uh   spent years and years f uh  lobbying for their release and their ability to f um   immigrate from russia ,sv,MALE,3
['uh-huh. /'],uhhuh ,b,FEMALE,2
"['-- as soon as that occurred, we <inhaling> simply said that, {f uh, } <breathing> instead of the, {f uh, } hundred and fifty thousand  or so who wanted to immigrate to this country, we cut that by, {f uh, } two thirds.  /']", as soon as that occurred we inhaling simply said that f uh  breathing instead of the f uh  hundred and fifty thousand  or so who wanted to immigrate to this country we cut that by f uh  two thirds  ,+,MALE,0
['{c so. } -/'],c so  ,%,MALE,5
['{f huh. } /'],f huh  ,b,FEMALE,2
"['i do not quite go along with that,  /']",i do not quite go along with that  ,sd,MALE,1
['{c but } <laughter>. -/'],c but  laughter ,%,MALE,5
"['no,  /']",no  ,aa,FEMALE,4
"[""that doesn't make a whole of lot sense. /""]",that doesnt make a whole of lot sense ,sv,FEMALE,3
['no.  /'],no  ,aa,MALE,4
"['{c and } i still think, - /']",c and  i still think  ,%,MALE,5
"['{d you know, } again,   kind of having, {f uh, } {f uh, } within this century, come from [ a, +  {f uh, } an ] immigrant family,  or immigrant families on both sides. -/']",d you know  again   kind of having f uh  f uh  within this century come from  a   f uh  an  immigrant family  or immigrant families on both sides ,sd,MALE,1
['uh-huh. /'],uhhuh ,b,FEMALE,2
"[""both my mother's parents  and my father's parents were  immigrants  /""]",both my mothers parents  and my fathers parents were  immigrants  ,sd,MALE,1
"[""{c so, } i'm a little touchy <throat_clearing> every now and then about  that <laughter>. /""]",c so  im a little touchy throatclearing every now and then about  that laughter ,sd,MALE,1
['<laughter> yeah.  /'],laughter yeah  ,b,FEMALE,2
"['{d well, } {f uh, } [ my, + {f uh, } my ]   family is from, {f uh, } europe [ from, +  {d well, } from ] england and ireland --']",d well  f uh   my  f uh  my    family is from f uh  europe  from   d well  from  england and ireland ,sd,FEMALE,1
['uh-huh. /'],uhhuh ,b,MALE,2
"['-- and, {f uh, } have been in this country  for, {f oh, } more than a hundred and  fifty years --']", and f uh  have been in this country  for f oh  more than a hundred and  fifty years ,+,FEMALE,0
"['{f oh, } my <laughter>. /']",f oh  my laughter ,ba,MALE,6
"['-- almost two hundred years,  /']", almost two hundred years  ,+,FEMALE,0
"[""{c so, } i don't have  [ any, + any, ] {f uh, } relatives [ that i am, +  {e or, } {e or, } {f uh, } several generations back, that i am ] familiar with their names and how they fit into the family.  /""]",c so  i dont have   any  any  f uh  relatives  that i am   e or  e or  f uh  several generations back that i am  familiar with their names and how they fit into the family  ,sd,FEMALE,1
"['[ they were all, + they were all ]  born here -- /']", they were all  they were all   born here  ,sd,FEMALE,1
['uh-huh. /'],uhhuh ,b,MALE,2
"[""-- {c so } i don't have any real strong ties  [ with any, + [ with, + with ] the ] immigration laws.  /""]", c so  i dont have any real strong ties   with any   with  with  the  immigration laws  ,sd,FEMALE,1
"[""[ [ i don't, + because i don't, ] + i don't ]  have any personal feelings about them  /""]",  i dont  because i dont   i dont   have any personal feelings about them  ,sd,FEMALE,1
"[""{c and } i haven't taken the time or effort  to learn what they are. /""]",c and  i havent taken the time or effort  to learn what they are ,sd,FEMALE,1
"['{d well, } i think in a way, though, {f uh, } {f uh, }  i also have, {f uh, } an <laughter> opposite point of view, which is, {f uh, } although i believe  we should, {f uh, } permit, {f uh, } {d you know, } constant immigration into this country --']",d well  i think in a way though f uh  f uh   i also have f uh  an laughter opposite point of view which is f uh  although i believe  we should f uh  permit f uh  d you know  constant immigration into this country ,sv,MALE,3
['{f um. } /'],f um  ,b,FEMALE,2
"['-- {f uh, } [ i think we should, + {f uh, } primarily for  economic reasons, i think we should ] have, {f um, } some quotas,  /']", f uh   i think we should  f uh  primarily for  economic reasons i think we should  have f um  some quotas  ,+,MALE,0
"['of course, my family   and i, - /']",of course my family   and i  ,%,MALE,5
"['[ again, + again ] that was, {d you know, } - /']", again  again  that was d you know   ,%,MALE,5
"['my grandparents came over during  the time when, {f uh, } there were quotas.  /']",my grandparents came over during  the time when f uh  there were quotas  ,sd,MALE,1
"['{c so } they had to wait, {f uh, } {d you know, }  in, {f uh, } certain parts of europe for years before they were permitted to come over. /']",c so  they had to wait f uh  d you know   in f uh  certain parts of europe for years before they were permitted to come over ,sd,MALE,1
['uh-huh. /'],uhhuh ,b,FEMALE,2
"['{c so, } {d you know, } - /']",c so  d you know   ,%,MALE,5
"['<laughter> {c but, }  {f uh } --']",laughter c but   f uh  ,sv,MALE,3
['yeah.  /'],yeah  ,b,FEMALE,2
"['[ [ i, + i, ] +']",  i  i  ,aa,FEMALE,4
"['-- i think unrestricted immigration, i think,  [ is not, + {f uh, } is not ] best, {f uh. } /']", i think unrestricted immigration i think   is not  f uh  is not  best f uh  ,+,MALE,0
"['{d well, } i ] agree with that,  /']",d well  i  agree with that  ,+,FEMALE,0
"['[ i, + i ] think if  immigration was entirely unrestricted, {f uh, } not only [ would, + would ] the united states  become [ over populated, + {d well, } more over populated ] awfully  quickly, i think [ it, + it ] would bring in a lot of, {f uh, } people that are, run out of other  countries or in trouble [ in, + in ] other countries.  /']", i  i  think if  immigration was entirely unrestricted f uh  not only  would  would  the united states  become  over populated  d well  more over populated  awfully  quickly i think  it  it  would bring in a lot of f uh  people that are run out of other  countries or in trouble  in  in  other countries  ,sv,FEMALE,3
"[""i think they'd come  here trying to find a new market for [ their, + their ] brand of crime. /""]",i think theyd come  here trying to find a new market for  their  their  brand of crime ,sv,FEMALE,3
['uh-huh.  /'],uhhuh  ,aa,MALE,4
"[""{d well, } {d you know, } there's another aspect  of this, too.  /""]",d well  d you know  theres another aspect  of this too  ,sd,MALE,1
"[""they're also, {f uh, } {f uh, } diminishing the, {f uh, } health  restrictions which, -/""]",theyre also f uh  f uh  diminishing the f uh  health  restrictions which ,sd,MALE,1
"['i was not [ aware, + aware ] of that. /']",i was not  aware  aware  of that ,sd,FEMALE,1
"['{d well, } yes.  /']",d well  yes  ,b,MALE,2
"['there [ are, +   were ] some, {f uh, } regulations over,  /']",there  are    were  some f uh  regulations over  ,sd,MALE,1
"[""i don't know whether they're laws passed [ or, + or ] whatever they're  called, {f uh, } just recently, where, {f uh, } people with certain diseases cannot be  excluded, {f uh, } from, {f uh, } immigration.  /""]",i dont know whether theyre laws passed  or  or  whatever theyre  called f uh  just recently where f uh  people with certain diseases cannot be  excluded f uh  from f uh  immigration  ,sd,MALE,1
"['age is one, for example,  /']",age is one for example  ,sd,MALE,1
"['{c and, }  {f uh, }  recently, {f uh, } tuberculosis, which at one time, if you had tuberculosis you could not get into this country --']",c and   f uh   recently f uh  tuberculosis which at one time if you had tuberculosis you could not get into this country ,sd,MALE,1
['uh-huh. /'],uhhuh ,b,FEMALE,2
"['-- {f uh, } they dropped that also.  /']", f uh  they dropped that also  ,+,MALE,0
"['{c so } i think [ in, + in ] [ some as-, + some ] ways we are, {f uh, } becoming a little too egalitarian [ in that, + in that ]  sense,  /']",c so  i think  in  in   some as  some  ways we are f uh  becoming a little too egalitarian  in that  in that   sense  ,sv,MALE,3
"['{c but, }  {f uh, } i think we should be a little more circumspect about it.  /']",c but   f uh  i think we should be a little more circumspect about it  ,sv,MALE,3
"['again, my opinion <laughter>. /']",again my opinion laughter ,sd,MALE,1
['yeah. /'],yeah ,b,FEMALE,2
"[""think we've talked long enough? /""]",think weve talked long enough ,qy,MALE,7
['i think so <laughter>. /'],i think so laughter ,na,FEMALE,21
['<laughter> all right. /'],laughter all right ,bk,MALE,14
"[""{d well, } i've enjoyed talking to you. /""]",d well  ive enjoyed talking to you ,fc,FEMALE,10
"['[ [ i, + i, ] + i ] have talked long enough. /']",  i  i   i  have talked long enough ,fc,MALE,10
['okay <laughter>. /'],okay laughter ,fc,FEMALE,10
['<laughter>.'],laughter,fc,MALE,10
['thanks. /'],thanks ,fc,FEMALE,10
['thank you. /'],thank you ,fc,MALE,10
['bye. /'],bye ,fc,FEMALE,10
['good-bye. /'],goodbye ,fc,MALE,10
