utterance,utterance_no_specialchar,da_tag,speaker_sex,da_category
"[""didn't hurt me, [ [ at, + at, ] +  at ] the moment.  /""]",didnt hurt me   at  at    at  the moment  ,sd,MALE,1
"[""[ [ [ {c so, } + {f um, } {c and, } ] + {c and, } ] + {c and } ] [ i, + i ] don't know.  /""]",   c so   f um  c and    c and    c and    i  i  dont know  ,h,MALE,15
"[""[ there's a, + there's ] something about, - /""]", theres a  theres  something about  ,%,MALE,5
"[""there's a poem somewhere.  /""]",theres a poem somewhere  ,sd,MALE,1
"[""i don't know if you've ever seen it or not,  /""]",i dont know if youve ever seen it or not  ,qy^d,MALE,16
['{c but } everything i ever wanted to know i learned in kindergarten. /'],c but  everything i ever wanted to know i learned in kindergarten ,sd,MALE,1
['yeah. /'],yeah ,b,MALE,2
"['in this, - /']",in this  ,%,MALE,5
"['{c and } it talks about how, {d you know, } if we could just all get toge-, {d you know, } - /']",c and  it talks about how d you know  if we could just all get toge d you know   ,sd,MALE,1
"['when we were young everything was great because we all went to class together,  /']",when we were young everything was great because we all went to class together  ,sd,MALE,1
"['{c and } in the mi-, {d you know, } - /']",c and  in the mi d you know   ,%,MALE,5
"['we all had snack time together,  /']",we all had snack time together  ,sd,MALE,1
['{c and then } we all took naps  /'],c and then  we all took naps  ,sd,MALE,1
"['{c and } we all held hands and hugged, {d you know, }  /']",c and  we all held hands and hugged d you know   ,sd,MALE,1
"[""[ [ {c and, } +  {c and, } ] + {c and } ] that's what kindergarten was like,  /""]",  c and    c and    c and   thats what kindergarten was like  ,sd,MALE,1
"[""{c and } wouldn't it be nice [ if, + if ] we could solve all our problems by just sort of getting together and everyone in the world sat down and took a nap together. /""]",c and  wouldnt it be nice  if  if  we could solve all our problems by just sort of getting together and everyone in the world sat down and took a nap together ,sv,MALE,3
['<laughter>.'],laughter,x,MALE,8
"['woke up and had snack time, {d you know, }  and then hugged each other as we left. /']",woke up and had snack time d you know   and then hugged each other as we left ,sd,MALE,1
"['[ it sounds like a, + it sounds like a ] john lennon, {f uh, } type. -/']", it sounds like a  it sounds like a  john lennon f uh  type ,sv,MALE,3
['yeah  /'],yeah  ,b,MALE,2
['<laughter>.  i wonder if he secretly did that ... /'],laughter  i wonder if he secretly did that  ,sd,MALE,1
