utterance,utterance_no_specialchar,da_tag,speaker_sex,da_category
"['{d so, } {f uh, } what do you think about our involvement in the middle east? /']",d so  f uh  what do you think about our involvement in the middle east ,qw,MALE,12
"[""<laughter> {d well, } {d actually, } i think it's good.  /""]",laughter d well  d actually  i think its good  ,sv,MALE,3
"[""[ [  i, + i, ] + i ] hope that we, {f uh, } {f uh, } get a chance to, {f uh, } promote peace out there, {f uh, } because i think without peace we're not going to get stable oil prices,  /""]",   i  i   i  hope that we f uh  f uh  get a chance to f uh  promote peace out there f uh  because i think without peace were not going to get stable oil prices  ,sv,MALE,3
"[""[ {c and, } + {c and,  } ] {f uh, } [ i'd, + i'd ] really like to see stability in that area, because i'm always afraid that's where another big war is going to start. not that desert storm was a small one. /""]", c and   c and    f uh   id  id  really like to see stability in that area because im always afraid thats where another big war is going to start not that desert storm was a small one ,sv,MALE,3
['yeah  /'],yeah  ,aa,MALE,4
"['<laughter>.  {d well, } yeah  /']",laughter  d well  yeah  ,aa,MALE,4
"[""that's probably true.  /""]",thats probably true  ,aa,MALE,4
"[""[  i,   +  i ] suspect that if any world war is coming at this point in time, they're going to come from there, {f uh, } i would think, anyway.  /""]",  i     i  suspect that if any world war is coming at this point in time theyre going to come from there f uh  i would think anyway  ,sv,MALE,3
"[""just seems to be that that's the most unstable part of the world, as far as i can tell. /""]",just seems to be that thats the most unstable part of the world as far as i can tell ,sv,MALE,3
"['i saw, {f um, } just recently, where, {f uh, } {f uh, } the u s is supposedly going to be, {f uh, } putting pressure on all the, {d you know, } the israelis, supposedly, to come to a bargaining table to, - /']",i saw f um  just recently where f uh  f uh  the u s is supposedly going to be f uh  putting pressure on all the d you know  the israelis supposedly to come to a bargaining table to  ,sd,MALE,1
"['{d actually } i heard that the israelis [ were even talk-, + ] at least mentioned about giving up some of the golan heights. /']",d actually  i heard that the israelis  were even talk   at least mentioned about giving up some of the golan heights ,sd,MALE,1
['really. /'],really ,b,MALE,2
['yeah. /'],yeah ,ny,MALE,9
"[""that would be interesting because [ [ [ i am, + {d actually, } {f um, } {f um, } i'm, ] + i'm ] + i'm ] jewish  /""]",that would be interesting because    i am  d actually  f um  f um  im   im   im  jewish  ,sd,MALE,1
"[""{c and } i'm actually sort of [ [ not, + not, ] + not ] really a zionist per se, {d you know. } /""]",c and  im actually sort of   not  not   not  really a zionist per se d you know  ,sd,MALE,1
['okay. /'],okay ,b,MALE,2
"['{c but } [ i have a, + {f um, } i have a ] lot of friends, {d you know, } who are sort of adamant, {d you know, } israel,  /']",c but   i have a  f um  i have a  lot of friends d you know  who are sort of adamant d you know  israel  ,sd,MALE,1
"[""it's his right,  /""]",its his right  ,^q,MALE,19
['{c and } do whatever they want. - /'],c and  do whatever they want  ,sv,MALE,3
"[""{c and } i think they've been sort of hard nosed about the entire thing.  /""]",c and  i think theyve been sort of hard nosed about the entire thing  ,sv,MALE,3
"['{c and, } {d you know, } in some sense, [ m-, + the moderates ] may be right.  /']",c and  d you know  in some sense  m  the moderates  may be right  ,sv,MALE,3
"['they [ may, + {d you know, } may ] be better if they give up just a little bit to settle things down. /']",they  may  d you know  may  be better if they give up just a little bit to settle things down ,sv,MALE,3
"[""{d well, } {f uh, } i guess it's one of those things that, {f uh, } if it's going to really promote a lasting peace, if there is not going to be a peace, -/""]",d well  f uh  i guess its one of those things that f uh  if its going to really promote a lasting peace if there is not going to be a peace ,sv,MALE,3
"['right,  /']",right  ,b,MALE,2
"['[ [ [ then, + then, ] + then, ] + then ] is it worth it at all. /']",   then  then   then   then  is it worth it at all ,qh,MALE,26
['yeah. /'],yeah ,b,MALE,2
"['{e i mean, } i could the way, - /']",e i mean  i could the way  ,%,MALE,5
"['{e i mean, } the only way to think about it is {d well, } they won, {d you know, } - /']",e i mean  the only way to think about it is d well  they won d you know   ,sv,MALE,3
"['they sort of took over the, {f um, } - /']",they sort of took over the f um   ,sv,MALE,3
"[""they're one of the only countries in history that has been told that they have to give back what they took in a war, which they didn't start, basically,  /""]",theyre one of the only countries in history that has been told that they have to give back what they took in a war which they didnt start basically  ,sv,MALE,3
['{c so. } -/'],c so  ,%,MALE,5
['oh.  /'],oh  ,b,MALE,2
['yeah  /'],yeah  ,b,MALE,2
['<laughter>.'],laughter,x,MALE,8
"[""{c so, } [ [ i don't, + i don't  know how to, ] + [ i don't, + i don't ] know what to ] do about it <noise>.  /""]",c so    i dont  i dont  know how to    i dont  i dont  know what to  do about it noise  ,sd,MALE,1
"['{c but } i think [ that, + that ] {d you know, } in general the region is really in bad shape <noise>. /']",c but  i think  that  that  d you know  in general the region is really in bad shape noise ,sv,MALE,3
"['do you think the u s is going to wind up keeping, {f uh, } military bases over there? /']",do you think the u s is going to wind up keeping f uh  military bases over there ,qy,MALE,7
"['{f um, } probably, {f oh, }  /']",f um  probably f oh   ,na,MALE,21
"[""[ isn't, + isn't ] there a plan now to make a command center there or something? /""]", isnt  isnt  there a plan now to make a command center there or something ,qy,MALE,7
"[""[ i, + i ] haven't heard that.  /""]", i  i  havent heard that  ,^h,MALE,27
"['i watch c n n every once in a while,  /']",i watch c n n every once in a while  ,^h,MALE,27
"[""{c but, } [ i, + i ] haven't specifically heard anything about that. /""]",c but   i  i  havent specifically heard anything about that ,ng,MALE,29
"['i just heard something [ about moving, + recently, about moving, ] {f um }  /']",i just heard something  about moving  recently about moving  f um   ,sd,MALE,1
"[""[ [ there, + there, ] + there's ] some central command post in tampa <<foreign location>>, i think that they now want to move to somewhere in the middle east.  /""]",  there  there   theres  some central command post in tampa foreign location i think that they now want to move to somewhere in the middle east  ,sd,MALE,1
"['{d actually, } there was, {f um, } a small country or small city, i think, [ or even, + ] not actually in saudi arabia or anything, but a little bit off to the, {f um, } east of it, i think.  /']",d actually  there was f um  a small country or small city i think  or even   not actually in saudi arabia or anything but a little bit off to the f um  east of it i think  ,sd,MALE,1
"['{c and } i, - /']",c and  i  ,%,MALE,5
"[""they want to keep something over there, so that they don't have to, {f um, } - /""]",they want to keep something over there so that they dont have to f um   ,sv,MALE,3
"[""[ i guess it's, + i guess it's ] sort of so they don't have to move troops out so quickly or something.  /""]", i guess its  i guess its  sort of so they dont have to move troops out so quickly or something  ,sd,MALE,1
"[""i'm not quite sure exactly why they want to do it.   /""]",im not quite sure exactly why they want to do it   ,sd,MALE,1
['{c but } they want to keep some sort of central command post there. /'],c but  they want to keep some sort of central command post there ,sv,MALE,3
"['what i thought was interesting is that, {f uh, } apparently the formal cease fire has not actually been signed yet. /']",what i thought was interesting is that f uh  apparently the formal cease fire has not actually been signed yet ,sv,MALE,3
"[""that's true. /""]",thats true ,aa,MALE,4
"[""{c and, } {f uh, } <laughter> then i guess there's still the possibility that, {f uh, } hostilities with, {f uh, } u s troops could still break out. /""]",c and  f uh  laughter then i guess theres still the possibility that f uh  hostilities with f uh  u s troops could still break out ,sv,MALE,3
"['yeah,  /']",yeah  ,b,MALE,2
"[""that's, - /""]",thats  ,%,MALE,5
"[""<noise> they claim that's why we're still there.  /""]",noise they claim thats why were still there  ,sv,MALE,3
"['{e i mean, } {d you know, } why only, - /']",e i mean  d you know  why only  ,%,MALE,5
"[""you note it's [ only, + only ] a small number of people have actually come back yet. /""]",you note its  only  only  a small number of people have actually come back yet ,qy^d,MALE,16
['yeah. /'],yeah ,b,MALE,2
"[""{c but } i think that's actually the scariest part, because [ when, in the way, + ]  [ what, + what's ] happening in iraq right now, {d you know, } in itself, it being so  crazy there.  /""]",c but  i think thats actually the scariest part because  when in the way     what  whats  happening in iraq right now d you know  in itself it being so  crazy there  ,sv,MALE,3
"['i have no idea,  /']",i have no idea  ,h,MALE,15
"['{e i mean, } what do you know, - /']",e i mean  what do you know  ,%,MALE,5
"[""just to imagine that one day they're just going to turn around and someone is going to say, we don't like you, and start attacking again,  /""]",just to imagine that one day theyre just going to turn around and someone is going to say we dont like you and start attacking again  ,sd,MALE,1
"[""{c and } it's going to be worse.  /""]",c and  its going to be worse  ,sv,MALE,3
"[""i don't know.  {f um. } /""]",i dont know  f um  ,h,MALE,15
['do you have relatives over in israel? /'],do you have relatives over in israel ,qy,MALE,7
"['no,  /']",no  ,nn,MALE,13
"[""i don't.  /""]",i dont  ,sd,MALE,1
"['[ i ha-, + [ [ i, + i, ] + i ] have ] some friends in israel,  /']", i ha    i  i   i  have  some friends in israel  ,sd,MALE,1
['{c and } coincidently {d actually } my wife is syrian.  {f um. } /'],c and  coincidently d actually  my wife is syrian  f um  ,sd,MALE,1
"['{f oh, } really. /']",f oh  really ,b,MALE,2
"['yeah,  /']",yeah  ,ny,MALE,9
"['{c so } i am, - /']",c so  i am  ,%,MALE,5
"['[ we are sort of, + we are ] the middle east peace talks at home. {f um. } /']", we are sort of  we are  the middle east peace talks at home f um  ,sd,MALE,1
['<laughter>.'],laughter,x,MALE,8
"[""{c and, } {f uh, } <noise> <<water sound>> {e pardon me, } i'm just sort of putting away some things from dinner now --""]",c and  f uh  noise water sound e pardon me  im just sort of putting away some things from dinner now ,sd,MALE,1
['yeah. /'],yeah ,b,MALE,2
['-- in the background.  /'], in the background  ,+,MALE,0
"['{c but } [ we, + {f um, } we, ] - /']",c but   we  f um  we   ,%,MALE,5
"['she has sort of friends and family in saudi arabia, who are some friends in saudi arabia.  /']",she has sort of friends and family in saudi arabia who are some friends in saudi arabia  ,sd,MALE,1
"['{c and, } {f um, } i have some friends in israel.  /']",c and  f um  i have some friends in israel  ,sd,MALE,1
"['{c and }  [ we, +  we ] talk a bit about it,  /']",c and    we   we  talk a bit about it  ,sd,MALE,1
['{c but } we try and keep it out of the home life. /'],c but  we try and keep it out of the home life ,sd,MALE,1
"['do you, {f uh, } - /']",do you f uh   ,qy,MALE,7
['does she ever want to go back to syria? /'],does she ever want to go back to syria ,qy,MALE,7
"['no,  /']",no  ,nn,MALE,13
"['[ she was, + she is ] {d actually, } {f um, } - /']", she was  she is  d actually  f um   ,%,MALE,5
"[""i think it's, {f um, } for her not really relevant, because she is second generation american, {d actually. } /""]",i think its f um  for her not really relevant because she is second generation american d actually  ,sv,MALE,3
"['{f oh, } okay. /']",f oh  okay ,bk,MALE,14
"['her parents who were born here would like to go see it, though, i think.  /']",her parents who were born here would like to go see it though i think  ,sd,MALE,1
"['they would like to go to syria,  /']",they would like to go to syria  ,sd,MALE,1
"[""{c but } they recognize that syria's not the place that one wants to visit --""]",c but  they recognize that syrias not the place that one wants to visit ,sd,MALE,1
['no. /'],no ,nn,MALE,13
['-- right about now. /'], right about now ,+,MALE,0
['no <laughter>. /'],no laughter ,nn,MALE,13
"['{d you know, } something about the place makes it [ not, + not ] quite enjoyable. /']",d you know  something about the place makes it  not  not  quite enjoyable ,sd,MALE,1
['do you ever want to go over to israel? /'],do you ever want to go over to israel ,qy,MALE,7
"['yeah,  /']",yeah  ,ny,MALE,9
"[""[ i, + i've ] actually been there. /""]", i  ive  actually been there ,sd,MALE,1
"['{f oh, } okay. /']",f oh  okay ,bk,MALE,14
"[""i was there a couple of years ago, when it wasn't, {d you know, } sort of dangerous to be out there, i guess. /""]",i was there a couple of years ago when it wasnt d you know  sort of dangerous to be out there i guess ,sd,MALE,1
['yeah. /'],yeah ,b,MALE,2
"['{c and, } [ i do, + i [ d-, + do ] ] like it {d actually. }  /']",c and   i do  i  d  do   like it d actually   ,sd,MALE,1
['i would never live there.  /'],i would never live there  ,sd,MALE,1
"[""i think i'm too americanized  and, {f um } <noise> sort of have [ too much, + {d you know, } too much ] invested in sort of, the easy life. /""]",i think im too americanized  and f um  noise sort of have  too much  d you know  too much  invested in sort of the easy life ,sv,MALE,3
['yeah. /'],yeah ,b,MALE,2
['yeah  /'],yeah  ,b,MALE,2
['<laughter>.'],laughter,x,MALE,8
"['<laughter> okay,  /']",laughter okay  ,b,MALE,2
"['{d well } who-, {d you know, } - /']",d well  who d you know   ,%,MALE,5
['do you have a lot of kosher foods there at your house? /'],do you have a lot of kosher foods there at your house ,qy,MALE,7
"['yeah,  /']",yeah  ,b,MALE,2
"['{d actually } my house is kosher,  /']",d actually  my house is kosher  ,sd,MALE,1
"[""{c but } it turns out that one of the strangest things [ about, + about ] israel is that [ no-, + ] {f um, } most folks don't realize that for all the food people think of as sort of, {d you know, } jewish food and so  forth.  /""]",c but  it turns out that one of the strangest things  about  about  israel is that  no   f um  most folks dont realize that for all the food people think of as sort of d you know  jewish food and so  forth  ,sv,MALE,3
"[""{f um, } {c and, } {d you know, } {f um, } in general it really isn't the food that is eaten in israel.  /""]",f um  c and  d you know  f um  in general it really isnt the food that is eaten in israel  ,sv,MALE,3
"['{c so } you typically think of it, like bagels,  /']",c so  you typically think of it like bagels  ,sv,MALE,3
"['right,  {d you know, }  /']",right  d you know   ,^g,MALE,40
['bagels and lox. /'],bagels and lox ,sd,MALE,1
['yeah  /'],yeah  ,ny,MALE,9
['<noise>.'],noise,x,MALE,8
"[""turns out, [ [ you don't, + you don't, ] + you don't ] really find bagels in israel.  /""]",turns out   you dont  you dont   you dont  really find bagels in israel  ,sd,MALE,1
['what you find is sort of middle eastern foods.  /'],what you find is sort of middle eastern foods  ,sd,MALE,1
"['the same foods that you find in, {f um, } syria and egypt and everything else.   /']",the same foods that you find in f um  syria and egypt and everything else   ,sd,MALE,1
['((   ))  <<middle eastern food>> have you ever had those? /'],     middle eastern food have you ever had those ,qy,MALE,7
"['no,  /']",no  ,nn,MALE,13
"[""kish ki's, or knishes <<jewish foods>>. /""]",kish kis or knishes jewish foods ,sd,MALE,1
"['{f oh, } knishes,  /']",f oh  knishes  ,b^m,MALE,24
['no  /'],no  ,nn,MALE,13
"[""[ you don't, + you don't ] see a lot of, - /""]", you dont  you dont  see a lot of  ,sd,MALE,1
"[""that's basically eastern european jewish food. /""]",thats basically eastern european jewish food ,sd,MALE,1
['oh. /'],oh ,b,MALE,2
"[""[ it's, + it's ] very different.  /""]", its  its  very different  ,sd,MALE,1
"[""i was {d actually } very amazed when i sort of figured out for myself.   that everything i grew up with really wasn't israeli.  /""]",i was d actually  very amazed when i sort of figured out for myself   that everything i grew up with really wasnt israeli  ,sd,MALE,1
"['it was more jewish, {d you know. } /']",it was more jewish d you know  ,sd,MALE,1
['i got you. /'],i got you ,ba,MALE,6
"['[ [   it, + it, ] + it ] is very strange. /']",    it  it   it  is very strange ,ba,MALE,6
"['still get your passover matzi and all that,  /']",still get your passover matzi and all that  ,sd,MALE,1
['right. /'],right ,^g,MALE,40
"['[ that, + that ] starts tomorrow night. /']", that  that  starts tomorrow night ,na,MALE,21
['<laughter>.'],laughter,x,MALE,8
"[""that's what i'm making,  /""]",thats what im making  ,sd,MALE,1
"[""that's what i'm doing now.  /""]",thats what im doing now  ,sd,MALE,1
"[""i'm making dinner. /""]",im making dinner ,sd,MALE,1
['{f oh } really.  /'],f oh  really  ,b,MALE,2
"['[  i dated, + {f uh, } i ] [ dated + ] a nice jewish girl for many years up in chicago,  /']",  i dated  f uh  i   dated   a nice jewish girl for many years up in chicago  ,sd,MALE,1
"['{c and } i was the only goyim [ at, + at ] all the seder dinners and everything,  /']",c and  i was the only goyim  at  at  all the seder dinners and everything  ,sd,MALE,1
"['{c and } i used to have to go with [ rolls of, not, + ] pocketful of change to buy all this bread the kids would see me <laughter>. /']",c and  i used to have to go with  rolls of not   pocketful of change to buy all this bread the kids would see me laughter ,sd,MALE,1
['bought up all the bread from <laughter>. /'],bought up all the bread from laughter ,^2,MALE,23
"['((   ))  <<inserted by j j g, transcriber left a blank turn>>.']",     inserted by j j g transcriber left a blank turn,x,MALE,8
"[""that's good.  /""]",thats good  ,ba,MALE,6
"[""{d well, } [ [ you've, + you've, ] + you've ] really got a handle on this stuff i've noticed. /""]",d well    youve  youve   youve  really got a handle on this stuff ive noticed ,sv,MALE,3
"['[ [ not, + not, ] +']",  not  not  ,bd,MALE,38
['got the vocabulary down and everything. /'],got the vocabulary down and everything ,sv,MALE,3
"['not, ] {f uh, } - /']",not  f uh   ,+,MALE,0
"['just, just enough to get by <laughter>. /']",just just enough to get by laughter ,bd,MALE,38
"['[ [ that, + that, ] + that ] makes you real good.  /']",  that  that   that  makes you real good  ,sv,MALE,3
"['yeah,  /']",yeah  ,%,MALE,5
"['[ [ we, + {f um, } we ] + {d actually, } we ] have the reverse situation.  /']",  we  f um  we   d actually  we  have the reverse situation  ,sd,MALE,1
"[""turned out that, {f um, } {f um, } most of my friends aren't jewish,  /""]",turned out that f um  f um  most of my friends arent jewish  ,sd,MALE,1
"[""[ {c and, } + {c and } ] my wife's not. /""]", c and   c and   my wifes not ,sd,MALE,1
['okay. /'],okay ,b,MALE,2
"['{c but } [ i, + {f um, } i ] sort of, {d you know, } do a lot of these things,  /']",c but   i  f um  i  sort of d you know  do a lot of these things  ,sd,MALE,1
"['[ {c so, } + {c so } ] that, {f um, } - /']", c so   c so   that f um   ,%,MALE,5
"['[ seder, + our first seder ] is tomorrow  night.  /']", seder  our first seder  is tomorrow  night  ,sd,MALE,1
['{c and } this is a rare exception.  /'],c and  this is a rare exception  ,sd,MALE,1
"['there are going to be sixteen people at my house tomorrow night,  which, - /']",there are going to be sixteen people at my house tomorrow night  which  ,sd,MALE,1
['and  five of them will be jewish. /'],and  five of them will be jewish ,sd,MALE,1
['oh. /'],oh ,b,MALE,2
"['[ two, + two ] years ago we had a seder,  /']", two  two  years ago we had a seder  ,sd,MALE,1
['we had sixteen people each night.  /'],we had sixteen people each night  ,sd,MALE,1
['sixteen is the magic number for us. /'],sixteen is the magic number for us ,sd,MALE,1
['wow <laughter>. /'],wow laughter ,ba,MALE,6
['{c and } i was the only jew both nights. /'],c and  i was the only jew both nights ,sd,MALE,1
['{f oh } really <laughter>. /'],f oh  really laughter ,b,MALE,2
"['[ so, + ] which to me is wonderful, because it means that people who never would get to see this, {f um, } [ so + ] get to see it.  /']", so   which to me is wonderful because it means that people who never would get to see this f um   so   get to see it  ,sv,MALE,3
"['{c and } my view is, passover [ is, + ] should sort of be, - /']",c and  my view is passover  is   should sort of be  ,sv,MALE,3
"['[ [ [ in, + in, ] + in, ] + in ] my mind passover is sort of a generic holiday anyway, because [ it, + it ] sort of predates christ. /']",   in  in   in   in  my mind passover is sort of a generic holiday anyway because  it  it  sort of predates christ ,sv,MALE,3
['yeah. /'],yeah ,b,MALE,2
['{d so. } -/'],d so  ,%,MALE,5
"['{d well, } they had the, - /']",d well  they had the  ,%,MALE,5
"['matter of fact i just watched charles heston [ this, + {f uh, } this ] weekend in the ten commandments. /']",matter of fact i just watched charles heston  this  f uh  this  weekend in the ten commandments ,sd,MALE,1
"['yeah,  /']",yeah  ,b,MALE,2
['i caught the end of that. /'],i caught the end of that ,sd,MALE,1
['did you? /'],did you ,qy,MALE,7
"['yeah,  /']",yeah  ,ny,MALE,9
"['every year, i try and catch that.  /']",every year i try and catch that  ,sd,MALE,1
['{c but } yeah.  /'],c but  yeah  ,%,MALE,5
"[""that's what always amazes me, {d actually, } [ is that, + {f um, } is that, ] {d you know, } - /""]",thats what always amazes me d actually   is that  f um  is that  d you know   ,sd,MALE,1
"['my wife and i always sort of bring this up about [ sh-, + ] her being syrian, {d you know, } and my being jewish, {d you know. }  /']",my wife and i always sort of bring this up about  sh   her being syrian d you know  and my being jewish d you know   ,sd,MALE,1
"['we look alike,  /']",we look alike  ,sd,MALE,1
"['we act alike,  /']",we act alike  ,sd,MALE,1
"['we sound alike,  /']",we sound alike  ,sd,MALE,1
"['{d well, } not totally alike  /']",d well  not totally alike  ,sd,MALE,1
"[""{c but } {d you know. }  {f um, } {f um, } it's amazing to think that people in the middle east sort of all hate each other. /""]",c but  d you know   f um  f um  its amazing to think that people in the middle east sort of all hate each other ,sv,MALE,3
"[""{d well, } that's, - /""]",d well  thats  ,%,MALE,5
"[""to me it's really, {f um, } - /""]",to me its really f um   ,sv,MALE,3
"['[ i guess, + i guess i can ] intellectually kind of come to grips with all of that.  /']", i guess  i guess i can  intellectually kind of come to grips with all of that  ,sv,MALE,3
"[""{c but, } {d you know, } emotionally i have a real difficult time believing [ [ that, + {f uh } that, ] + that ] people that believe in god and love, not war and to forgive can't get together. /""]",c but  d you know  emotionally i have a real difficult time believing   that  f uh  that   that  people that believe in god and love not war and to forgive cant get together ,sv,MALE,3
['right. /'],right ,b,MALE,2
"['{d you know, } i mea-, - /']",d you know  i mea  ,%,MALE,5
['i know that the problems are so deep.  /'],i know that the problems are so deep  ,sd,MALE,1
"[""{c but } {e i mean, } even within the muslim, {f uh, } religions, different sects, they can't get together. /""]",c but  e i mean  even within the muslim f uh  religions different sects they cant get together ,sd,MALE,1
['right.  /'],right  ,b,MALE,2
"[""[ that's, + that's ] {d actually } the part [ [ that, + that, ] + that ] i find really strange.  /""]", thats  thats  d actually  the part   that  that   that  i find really strange  ,sv,MALE,3
"['{e i mean, } [ [ i, + i, ] + i ] sort of understand somewhat.  /']",e i mean    i  i   i  sort of understand somewhat  ,sd,MALE,1
"['{e i mean, } [ i, + i, ] - /']",e i mean   i  i   ,%,MALE,5
"['knowing the history i understand that, the hatred of the muslims for, {d you know, } the israelis or whatever,  /']",knowing the history i understand that the hatred of the muslims for d you know  the israelis or whatever  ,sd,MALE,1
['{c and } i can sort of handle that  /'],c and  i can sort of handle that  ,sd,MALE,1
"['[ {c and } +  ((   )) , {c but } ] i sort of think about the muslims sort of running around have jihad against themselves. /']", c and         c but   i sort of think about the muslims sort of running around have jihad against themselves ,sv,MALE,3
['yeah. /'],yeah ,b,MALE,2
"['{d you know, } {e i mean, } [ {c and, } + {c and } ] that seems really weird. /']",d you know  e i mean   c and   c and   that seems really weird ,sv,MALE,3
"['{c or, } [ the, + {f uh, } {d you know, }  the ] catholics and the protestants up in ireland. /']",c or   the  f uh  d you know   the  catholics and the protestants up in ireland ,bf,MALE,20
"['right,  /']",right  ,aa,MALE,4
['exactly. /'],exactly ,aa,MALE,4
"['{d you know, } {e i mean, } -/']",d you know  e i mean  ,qy,MALE,7
"['[ same, + same ] thing. /']", same  same  thing ,sv,MALE,3
['yeah. /'],yeah ,b,MALE,2
"[""i don't, - /""]",i dont  ,%,MALE,5
"[""[ i'll, + i'll ] never understand it.  /""]", ill  ill  never understand it  ,sd,MALE,1
"['my view is look, what did you ever do to me. /']",my view is look what did you ever do to me ,qh,MALE,26
"['yeah,  /']",yeah  ,b,MALE,2
['yeah. /'],yeah ,b,MALE,2
