utterance,utterance_no_specialchar,da_tag,speaker_sex,da_category
['yeah. /'],yeah ,b,MALE,2
"[""-- i wouldn't get it.  /""]", i wouldnt get it  ,+,FEMALE,0
['period. /'],period ,sd,FEMALE,1
"[""((   ))  ford now announced i think  in ninety-two, they're going to put, {f uh, } air bags [ in their, +  in their ] vans. /""]",     ford now announced i think  in ninetytwo theyre going to put f uh  air bags  in their   in their  vans ,sd,MALE,1
['{f oh } that would be good. /'],f oh  that would be good ,sv,FEMALE,3
"['[ {c so, } + {f uh, } {c and } ]  i think, [ i, +  i ] believe safety, - /']", c so   f uh  c and    i think  i   i  believe safety  ,sv,MALE,3
"['[ [ [ i, + i, ] +  i, ] +  i ] really do believe in this stuff, {f uh, }  /']",   i  i    i    i  really do believe in this stuff f uh   ,sv,MALE,3
"['{c and } [ i, +  i ]  think it can go,  ((   )) , - /']",c and   i   i   think it can go        ,sv,MALE,3
"[""i'm not, - /""]",im not  ,%,MALE,5
['the air bags are a good deal  /'],the air bags are a good deal  ,sv,MALE,3
"[""{c but, } {f uh, } surprisingly,  {f uh, } they're, {f uh, } - /""]",c but  f uh  surprisingly  f uh  theyre f uh   ,%,MALE,5
"['you really need to do, - /']",you really need to do  ,sv,MALE,3
"['you need a combination of both the air bags [ and the, +  {f uh, }']",you need a combination of both the air bags  and the   f uh ,sv,MALE,3
"['{f oh } i think so too, /']",f oh  i think so too ,aa,FEMALE,4
['and the ] seat belts  /'],and the  seat belts  ,+,MALE,0
"['{c so, } -/']",c so  ,%,MALE,5
"[""i don't think they should do away  with the seat belts now. /""]",i dont think they should do away  with the seat belts now ,sv,FEMALE,3
['yeah. /'],yeah ,b,MALE,2
"[""i'm - /""]",im  ,%,FEMALE,5
['{c but } i think you need the shoulder thing -- -/'],c but  i think you need the shoulder thing  ,sv,FEMALE,3
['yeah. /'],yeah ,b,MALE,2
"['-- i think you need the thing around  your waist,  /']", i think you need the thing around  your waist  ,sv,FEMALE,3
"['{c but, } i think you need that bag to pop out too. /']",c but  i think you need that bag to pop out too ,sv,FEMALE,3
['yeah. /'],yeah ,b,MALE,2
"['{d you know, } because <breathing>  i know so many people, here that have been killed in head on collisions, where maybe  if they [ had, +  had ] [ that, +  that ] --']",d you know  because breathing  i know so many people here that have been killed in head on collisions where maybe  if they  had   had   that   that  ,sd,FEMALE,1
['yeah. /'],yeah ,b,MALE,2
"['-- air bag, they may still be walking around. /']", air bag they may still be walking around ,+,FEMALE,0
['yeah. /'],yeah ,b,MALE,2
"[""{c but, } {f uh, } i think it's fantastic.  /""]",c but  f uh  i think its fantastic  ,sv,FEMALE,3
['i wish they required it in everything.  /'],i wish they required it in everything  ,sv,FEMALE,3
"['every new car that came out, i wish they would require it in it. /']",every new car that came out i wish they would require it in it ,sv,FEMALE,3
"[""<breathing> it would be  ((   ))  that  would do to our insurance rates, {d you know, }  [ [ if, +  if, ] +  {f uh, } if ]  the insurance companies [ says it, +  says we're ] not going to pay, {d you know, } a claim, [ if, +  if ]  the car doesn't have, {f uh, } air bags.  /""]",breathing it would be       that  would do to our insurance rates d you know     if   if    f uh  if   the insurance companies  says it   says were  not going to pay d you know  a claim  if   if   the car doesnt have f uh  air bags  ,sv,MALE,3
"[""would be interesting wouldn't it? /""]",would be interesting wouldnt it ,qy,MALE,7
['yeah. /'],yeah ,ny,FEMALE,9
"[""{f uh, } that wouldn't be fair  /""]",f uh  that wouldnt be fair  ,sv,MALE,3
"['{c but, } {f uh, } -/']",c but  f uh  ,%,MALE,5
"[""{d well, } no  because what they would  do is, that's what they're going to plan on, {d you know, }  /""]",d well  no  because what they would  do is thats what theyre going to plan on d you know   ,sv,FEMALE,3
"['they would have to do it,  /']",they would have to do it  ,sv,FEMALE,3
['the insurance company would have to do the same thing.  /'],the insurance company would have to do the same thing  ,sv,FEMALE,3
"[""<breathing> they're given  like, a ten year time limit --""]",breathing theyre given  like a ten year time limit ,sv,FEMALE,3
['yeah. /'],yeah ,b,MALE,2
"['-- where, - /']", where  ,+,FEMALE,0
['okay.  /'],okay  ,%,FEMALE,5
"['these cars,  {a i guess they figure all the old cars, } will be off the roads or something [ by the, +  in ten ] years -- /']",these cars  a i guess they figure all the old cars  will be off the roads or something  by the   in ten  years  ,sv,FEMALE,3
['yeah. /'],yeah ,b,MALE,2
"[""-- {c and then, } {d you know, } if  you didn't have a car that had one, then your insurance would go up enormously, /""]", c and then  d you know  if  you didnt have a car that had one then your insurance would go up enormously ,sv,FEMALE,3
"['uh-huh,  /']",uhhuh  ,b,MALE,2
"['uh-huh,  /']",uhhuh  ,b,MALE,2
"[""{f uh, } i've  got to go <laughter>  /""]",f uh  ive  got to go laughter  ,sd,MALE,1
"[""my son's in a performance tonight,  /""]",my sons in a performance tonight  ,sd,MALE,1
"['i have to leave,']",i have to leave,sd,MALE,1
"[""{f oh } that's okay, /""]",f oh  thats okay ,bd,FEMALE,38
['in a couple of minutes.  /'],in a couple of minutes  ,+,MALE,0
"[""{f uh, } i think we've probably spent a reasonable amount of time. /""]",f uh  i think weve probably spent a reasonable amount of time ,sv,MALE,3
['okay. /'],okay ,aa,FEMALE,4
"['it was good talking to you, /']",it was good talking to you ,fc,MALE,10
"['{d well, } [ you, +  you ] too. /']",d well   you   you  too ,fc,FEMALE,10
['okay.  /'],okay  ,fc,MALE,10
['good night. /'],good night ,fc,MALE,10
['all right  /'],all right  ,fc,FEMALE,10
['bye bye. /'],bye bye ,fc,FEMALE,10
