utterance,utterance_no_specialchar,da_tag,speaker_sex,da_category
"[""{c and, }  {f uh, } i didn't know how to work the  machine, {d you know. }  /""]",c and   f uh  i didnt know how to work the  machine d you know   ,sd,FEMALE,1
"['{c and } it really scared me, really bad.  /']",c and  it really scared me really bad  ,sd,FEMALE,1
"[""{c because } i thought all these people  are going to laugh at me because i don't know how to work this machine.  /""]",c because  i thought all these people  are going to laugh at me because i dont know how to work this machine  ,sd,FEMALE,1
"[""where [ if they'd, + if they'd ] had a class or something or # just [ to +  a short  time, {d you know, } to, ] (( said ))  {d okay, } this is the way, # -/""]",where  if theyd  if theyd  had a class or something or  just  to   a short  time d you know  to   said   d okay  this is the way  ,sv,FEMALE,3
"['# {d well, } [ just the, + just the ] opportunity to  try the # voting machines,  /']", d well   just the  just the  opportunity to  try the  voting machines  ,sv,FEMALE,3
['yeah. /'],yeah ,aa,FEMALE,4
['right.  /'],right  ,aa,FEMALE,4
"[""[ it's, + this is ] the way it's going to be.  /""]", its  this is  the way its going to be  ,^q,FEMALE,19
['{c and } my son was exactly the same way that i was  /'],c and  my son was exactly the same way that i was  ,sd,FEMALE,1
"[""{c and } i didn't realize it  until, {f uh, } his senior year.  /""]",c and  i didnt realize it  until f uh  his senior year  ,sd,FEMALE,1
"['i [ s-, + ] asked him something about {d well } [ did you, + who did you ]  vote  [ for, + for, ] {f uh, } cheerleader <tones>?  /']",i  s   asked him something about d well   did you  who did you   vote   for  for  f uh  cheerleader tones  ,sd,FEMALE,1
"[""{c and } he said, {f oh } i didn't go vote.  /""]",c and  he said f oh  i didnt go vote  ,sd,FEMALE,1
"[""he said, {f uh, } there's no way i'm getting in that machine.  /""]",he said f uh  theres no way im getting in that machine  ,sd,FEMALE,1
['{d well } then i realized  it  /'],d well  then i realized  it  ,sd,FEMALE,1
"['{c so } when we went and voted the next time, i asked the, {f uh, } lady, i said i want  my son to come in with me  /']",c so  when we went and voted the next time i asked the f uh  lady i said i want  my son to come in with me  ,sd,FEMALE,1
"['{c and } she said {d well, } {f uh, }  why, {d you know. }  /']",c and  she said d well  f uh   why d you know   ,sd,FEMALE,1
"[""he'll have to come back out.  /""]",hell have to come back out  ,^q,FEMALE,19
['i said because i want him to know how to # use </tones> # --'],i said because i want him to know how to  use tones  ,sd,FEMALE,1
['# right. # /'], right  ,b,FEMALE,2
['-- one of these  /'], one of these  ,+,FEMALE,0
"[""{c and } i said, i won't turn any of  the buttons down  /""]",c and  i said i wont turn any of  the buttons down  ,sd,FEMALE,1
"[""{c but } i want to show him how to use it so that # he'll be # --""]",c but  i want to show him how to use it so that  hell be  ,sd,FEMALE,1
['# yes.  /'], yes  ,b,FEMALE,2
['uh-huh. # /'],uhhuh  ,b,FEMALE,2
['-- able to vote <lipsmack>.  /'], able to vote lipsmack  ,+,FEMALE,0
"['[ {c and, } + {f uh, } {c so } ] he  went in  /']", c and   f uh  c so   he  went in  ,sd,FEMALE,1
"[""{c and } now # he's a # --""]",c and  now  hes a  ,sd,FEMALE,1
['# good. # /'], good  ,ba,FEMALE,6
['-- registered voter.  /'], registered voter  ,+,FEMALE,0
['{c but } he would not # vote # --'],c but  he would not  vote  ,sd,FEMALE,1
['# yeah. # /'], yeah  ,b,FEMALE,2
['-- before then.   /'], before then   ,+,FEMALE,0
"[""{c and, }  {e i mean, } # i think that's  bad. # /""]",c and   e i mean   i think thats  bad  ,sv,FEMALE,3
['# sure it is. #  /'], sure it is   ,aa,FEMALE,4
['# absolutely. # /'], absolutely  ,aa,FEMALE,4
"['# {d you know, } here # i was.  /']", d you know  here  i was  ,sd,FEMALE,1
"[""[ {c and, } +  {c and } ]  even, of course there's a lot of years between the two of us,  /""]", c and    c and    even of course theres a lot of years between the two of us  ,sd,FEMALE,1
"['{c but } even with that many years  between </static> </tv>, -/']",c but  even with that many years  between static tv ,%,FEMALE,5
