utterance,utterance_no_specialchar,da_tag,speaker_sex,da_category
"['{c and so }  god just really blesses him in ways like that,  /']",c and so   god just really blesses him in ways like that  ,sd,FEMALE,1
"[""do trust god because, i don't know, kids are a  blessing  /""]",do trust god because i dont know kids are a  blessing  ,ad,FEMALE,22
"['[ {c and, } +  {c and } ] [ some people +  ((   ))  {d you know, } we ] think of blessings  as nice furniture and things like that,  /']", c and    c and    some people        d you know  we  think of blessings  as nice furniture and things like that  ,sv,FEMALE,3
['{c but } kids are just as much of a blessing   (( inside these ))  material things  /'],c but  kids are just as much of a blessing    inside these   material things  ,sv,FEMALE,3
"[""{c but } it's a different kind  /""]",c but  its a different kind  ,sv,FEMALE,3
"[""{c and } a lot times people  think, {f oh, } {d well, } i'm not blessed  /""]",c and  a lot times people  think f oh  d well  im not blessed  ,sv,FEMALE,3
['i have an old car.  /'],i have an old car  ,^q,FEMALE,19
"[""{c but } you've got five kids, {d you know, } /""]",c but  youve got five kids d you know  ,^q,FEMALE,19
['uh-huh. /'],uhhuh ,b,FEMALE,2
"[""you're just as blessed, probably more,  because if you follow this, - /""]",youre just as blessed probably more  because if you follow this  ,^q,FEMALE,19
"[""there's a good book called what the  bible has to say about child training,""]",theres a good book called what the  bible has to say about child training,sd,FEMALE,1
['uh-huh. /'],uhhuh ,b,FEMALE,2
['by  (( richard fugate ))  /'],by   richard fugate   ,+,FEMALE,0
"[""{c and } he's, {d you know, } - /""]",c and  hes d you know   ,%,FEMALE,5
['a lot of wisdom in it.  /'],a lot of wisdom in it  ,sd,FEMALE,1
['{c and } the kids at  (( bible ))  talk about anything  /'],c and  the kids at   bible   talk about anything  ,sd,FEMALE,1
"['[ {c but }  training, +   {c and } training ] is different than anything else  /']", c but   training    c and  training  is different than anything else  ,sv,FEMALE,3
"[""[ in, +  in ] psychology  doesn't address it.  /""]", in   in  psychology  doesnt address it  ,sv,FEMALE,3
"[""[ a lot of the psychology stuff, +  the good stuff that's  in psychology ] it just comes out of the bible  /""]", a lot of the psychology stuff   the good stuff thats  in psychology  it just comes out of the bible  ,sv,FEMALE,3
"[""{c and } they don't quote you the  proverb out of it,  /""]",c and  they dont quote you the  proverb out of it  ,sd,FEMALE,1
"[""{c but } the things that work in psychology other   the years that they've proven  to work, they just come out of the bible  /""]",c but  the things that work in psychology other   the years that theyve proven  to work they just come out of the bible  ,sv,FEMALE,3
['{c and } so this book it just really   ((   ))  all these things and how to train the child  /'],c and  so this book it just really        all these things and how to train the child  ,sv,FEMALE,3
"[""{c so } they're not going  to be a curse to you when they're thirteen. /""]",c so  theyre not going  to be a curse to you when theyre thirteen ,sd,FEMALE,1
['uh-huh. /'],uhhuh ,b,FEMALE,2
"[""[ (( what )) +  {e i mean } how ]  to train them so they're going to be a  blessing  /""]",  what    e i mean  how   to train them so theyre going to be a  blessing  ,sd,FEMALE,1
"['{c and so, }  {d you know, } they do that  /']",c and so   d you know  they do that  ,sd,FEMALE,1
"['{c and } [ they, +  they ]  just live lean pretty much  /']",c and   they   they   just live lean pretty much  ,sd,FEMALE,1
"[""[ they don't, + she doesn't ] shop at foley's {d you know, }  and stuff like that.  /""]", they dont  she doesnt  shop at foleys d you know   and stuff like that  ,sd,FEMALE,1
"[""{c but } a lot women (( die or shop ))  at foley's  /""]",c but  a lot women  die or shop   at foleys  ,sv,FEMALE,3
"['{c so } (( things )) , -/']",c so   things   ,%,FEMALE,5
"[""[ i, +  i ] don't know what foley's is <laughter>. /""]", i   i  dont know what foleys is laughter ,sd,FEMALE,1
"[""it's like a macy's,""]",its like a macys,sd,FEMALE,1
['uh-huh. /'],uhhuh ,b,FEMALE,2
"['kind of store,  /']",kind of store  ,+,FEMALE,0
"[""it's pretty nice  /""]",its pretty nice  ,sd,FEMALE,1
"[""{c and } everything's pretty expensive  /""]",c and  everythings pretty expensive  ,sd,FEMALE,1
"[""{c and, } {d you know, } you just can't do that  /""]",c and  d you know  you just cant do that  ,sd,FEMALE,1
"[""{c and } you don't go to baseball games as much  /""]",c and  you dont go to baseball games as much  ,sd,FEMALE,1
['{c or } you get pictures like we did.  /'],c or  you get pictures like we did  ,sd,FEMALE,1
['{d you know } what i mean? /'],d you know  what i mean ,qy,FEMALE,7
['yeah. /'],yeah ,ny,FEMALE,9
"['you do these fun things, {d you know, }  in other kinds of ways  /']",you do these fun things d you know   in other kinds of ways  ,sv,FEMALE,3
"[""{c and } i know manhattan's real expensive  /""]",c and  i know manhattans real expensive  ,sd,FEMALE,1
"[""{c but, } {f um, } it's kind of a different situation because you're probably living in an apartment, right? /""]",c but  f um  its kind of a different situation because youre probably living in an apartment right ,qy,FEMALE,7
"['yeah,  /']",yeah  ,ny,FEMALE,9
"['{d well, } that makes a really big  difference.  /']",d well  that makes a really big  difference  ,sv,FEMALE,3
"['[ {c but, } +']", c but  ,sv,FEMALE,3
['yeah. /'],yeah ,b,FEMALE,2
"[""{c but, } ] still it's just as hard  as having, that,  /""]",c but   still its just as hard  as having that  ,+,FEMALE,0
['{c but }  ((   ))  your cousin could have a baseball team with twelve kids <laughter>. /'],c but        your cousin could have a baseball team with twelve kids laughter ,sd,FEMALE,1
"['<laughter> {d well, }  ((   ))  church  ((   ))  softball leagues, - /']",laughter d well        church       softball leagues  ,%,FEMALE,5
"['{c so, } -/']",c so  ,%,FEMALE,5
['uh-huh. /'],uhhuh ,b,FEMALE,2
"[""they're not all boys  /""]",theyre not all boys  ,sd,FEMALE,1
"[""{c and } right now we don't have a girls'   league because i'm the one that's supposed to start one  /""]",c and  right now we dont have a girls   league because im the one thats supposed to start one  ,sd,FEMALE,1
"[""{c and } i just haven't gotten around to doing it.  /""]",c and  i just havent gotten around to doing it  ,sd,FEMALE,1
['i keep saying we need to have one.  /'],i keep saying we need to have one  ,sd,FEMALE,1
"['they go, okay, then start one.  /']",they go okay then start one  ,sd,FEMALE,1
['(( {c but } ))  everybody  ((   ))  wants to do it  /'], c but    everybody       wants to do it  ,sd,FEMALE,1
"[""{c but, } {d you know, } god's sitting on my heart  /""]",c but  d you know  gods sitting on my heart  ,sd,FEMALE,1
"[""{c and } i just hadn't gotten around to doing it,  /""]",c and  i just hadnt gotten around to doing it  ,sd,FEMALE,1
"['[ {c but } anyway, +  {c so } ] they could really only have four members on the team.  /']", c but  anyway   c so   they could really only have four members on the team  ,sd,FEMALE,1
['i think they only have four (( boys )) .  /'],i think they only have four  boys    ,sd,FEMALE,1
"[""i don't even think they have    but two old enough to play yet. /""]",i dont even think they have    but two old enough to play yet ,sd,FEMALE,1
['uh-huh. /'],uhhuh ,b,FEMALE,2
"[""{c but, {f um, }  (( then )) }   you didn't believe me about her kids  /  *[[listen: this and utt2 as one utt]]""]",c but f um    then     you didnt believe me about her kids    listen this and utt2 as one utt,sv,FEMALE,3
['[ (( are the )) + they are ] so good.  /'],  are the   they are  so good  ,sd,FEMALE,1
"[""i'm not kidding you  /""]",im not kidding you  ,sd,FEMALE,1
['{c but } she does work with them  /'],c but  she does work with them  ,sd,FEMALE,1
"[""{c and } it's a commitment  /""]",c and  its a commitment  ,sd,FEMALE,1
"[""{c and, } [ that, +  that's ]  what they're called to do. /""]",c and   that   thats   what theyre called to do ,sd,FEMALE,1
['uh-huh. /'],uhhuh ,b,FEMALE,2
"['i have a, - /']",i have a  ,%,FEMALE,5
"['most of my friends, -/']",most of my friends ,%,FEMALE,5
"['i admire someone that can do that, {d you know, }  /']",i admire someone that can do that d you know   ,sd,FEMALE,1
['i really can. /'],i really can ,sd,FEMALE,1
"['i know,  /']",i know  ,aa,FEMALE,4
"['i do too,  /']",i do too  ,aa,FEMALE,4
"['[ i, +  most of my ]  friends have three or four kids  /']", i   most of my   friends have three or four kids  ,sd,FEMALE,1
"[""{c and } they feel like, {d you know, } that's  (( really ))   why god  ((   )) - /""]",c and  they feel like d you know  thats   really    why god       ,sd,FEMALE,1
['{c and } some of the people in our church use birth control  /'],c and  some of the people in our church use birth control  ,sd,FEMALE,1
"[""{c and } some of them don't,  /""]",c and  some of them dont  ,sd,FEMALE,1
['i had my tubes tied  /'],i had my tubes tied  ,sd,FEMALE,1
"['{c so } you, -/']",c so  you ,%,FEMALE,5
