utterance,utterance_no_specialchar,da_tag,speaker_sex,da_category
"['{d well, } have you ever served on a jury? /']",d well  have you ever served on a jury ,qy,FEMALE,7
"['no,  /']",no  ,nn,MALE,13
"[""i've not.  /""]",ive not  ,sd,MALE,1
"[""i've been called,  /""]",ive been called  ,sd,MALE,1
['{c but } i had to beg off from the duty.  /'],c but  i had to beg off from the duty  ,sd,MALE,1
['{c and } you? /'],c and  you ,qy,MALE,7
"['{d well, } i was called  /']",d well  i was called  ,na,FEMALE,21
['{c and then } i was not chosen. /'],c and then  i was not chosen ,sd,FEMALE,1
['{f um. }  /'],f um   ,%,MALE,5
"['{d well, } [ i was, + i was, ] {f uh, } originally chosen primarily, i think, because i was a young fellow  /']",d well   i was  i was  f uh  originally chosen primarily i think because i was a young fellow  ,sv,MALE,3
['{c and } they tend to view the younger fellows as more likely to hand down a guilty verdict.  /'],c and  they tend to view the younger fellows as more likely to hand down a guilty verdict  ,sv,MALE,3
"[""i don't know why.  /""]",i dont know why  ,sd,MALE,1
['something i picked up in a psychology class some time ago. /'],something i picked up in a psychology class some time ago ,sd,MALE,1
"['{f oh, } really? /']",f oh  really ,bh,FEMALE,18
"['yeah,  /']",yeah  ,ny,MALE,9
"[""it's that the younger they are, they tend to be more conservative for some statistical oddball reason,  /""]",its that the younger they are they tend to be more conservative for some statistical oddball reason  ,sd,MALE,1
['{c and } <inhaling> they kind of liked me.  /'],c and  inhaling they kind of liked me  ,sd,MALE,1
"['i looked conser-, <breathing> and all that stuff  /']",i looked conser breathing and all that stuff  ,sd,MALE,1
"['{c and } they, - /']",c and  they  ,%,MALE,5
"[""i don't know what they saw in me,  /""]",i dont know what they saw in me  ,sd,MALE,1
['{c but } they saw it.  /'],c but  they saw it  ,sd,MALE,1
"['{c but, } {f uh, } back to the issue, [ is, + ] {f uh, } - /']",c but  f uh  back to the issue  is   f uh   ,sd,MALE,1
"[""i don't know,  /""]",i dont know  ,h,MALE,15
"[""at times i feel that a unanimous decision is warranted, especially in cases in which there's no smoking gun.  /""]",at times i feel that a unanimous decision is warranted especially in cases in which theres no smoking gun  ,sv,MALE,3
"['{c but, } there, too, there are also cases in which i feel a majority rule might be acceptable, particularly, i think in civil cases.  /']",c but  there too there are also cases in which i feel a majority rule might be acceptable particularly i think in civil cases  ,sv,MALE,3
"[""in criminal cases, i'd like to see the [ unani-, + unanimity ] remain,  /""]",in criminal cases id like to see the  unani  unanimity  remain  ,sv,MALE,3
"['{c but } in civil cases, i think a majority rule [ by, + by ] jury would be sufficient. /']",c but  in civil cases i think a majority rule  by  by  jury would be sufficient ,sv,MALE,3
"['{d well, } {f uh, } could you give me an example of a case where you think that? /']",d well  f uh  could you give me an example of a case where you think that ,qo,FEMALE,25
"['{d well, } in a criminal case, say one in which, {d you know, } there is, {d like, } say assault or some such. i think there ought to be a unanimous, {f uh, } vote because by law and by constitution there must be proven beyond a shadow of a reasonable doubt that the person in question did this.  /']",d well  in a criminal case say one in which d you know  there is d like  say assault or some such i think there ought to be a unanimous f uh  vote because by law and by constitution there must be proven beyond a shadow of a reasonable doubt that the person in question did this  ,sv,MALE,3
"[""{c and } in civil law there, {d you know, } is such a thing as {d like, } let's say, {f uh, } <breathing> misappropriations or misuse of financial instruments or something like that.  /""]",c and  in civil law there d you know  is such a thing as d like  lets say f uh  breathing misappropriations or misuse of financial instruments or something like that  ,sd,MALE,1
"['a majority rule, i think, would be more in line as there is no real smoking gun in the civil cases.  /']",a majority rule i think would be more in line as there is no real smoking gun in the civil cases  ,sv,MALE,3
"[""i don't know if i'm making any sense or not. /""]",i dont know if im making any sense or not ,h,MALE,15
"['{d well, } {e i mean, } i think, - /']",d well  e i mean  i think  ,sv,FEMALE,3
"['are you just trying to say that criminal cases are more, {f uh, } tangible  /']",are you just trying to say that criminal cases are more f uh  tangible  ,qy,FEMALE,7
"['{c or, } -/']",c or  ,%,FEMALE,5
"['yeah,  /']",yeah  ,ny,MALE,9
"[""often there's more incriminating evidence.  /""]",often theres more incriminating evidence  ,sv,MALE,3
"['{d like, } for instance, say, {f uh, } - /']",d like  for instance say f uh   ,ad,MALE,22
"[""{c and } also, too, i think [ i'm, + i'm ] tempering this and the fact that the consequences are much more, {f uh, } serious in a criminal case. /""]",c and  also too i think  im  im  tempering this and the fact that the consequences are much more f uh  serious in a criminal case ,sv,MALE,3
"['{d well, } do you think [ that, + that ] in a civil case, if there was majority rule, that it would be easy for someone to be set up? /']",d well  do you think  that  that  in a civil case if there was majority rule that it would be easy for someone to be set up ,qy,FEMALE,7
"[""{f um, } {d well, } i really can't say for certain, truth be known.  /""]",f um  d well  i really cant say for certain truth be known  ,^h,MALE,27
"[""{f uh, } as it stands, [ there's, + there's ] many ways and means by which a person can be set up, both, {f uh, } in a [ ((civil)), + {f uh, } civil ] and criminal case.  /""]",f uh  as it stands  theres  theres  many ways and means by which a person can be set up both f uh  in a  civil  f uh  civil  and criminal case  ,sv,MALE,3
"['{e i mean, } the, {f uh, } documentary, the thin blue line pretty much demonstrated that.  /']",e i mean  the f uh  documentary the thin blue line pretty much demonstrated that  ,sv,MALE,3
"[""{d you know, } i don't know [ for, + if ] you're familiar with that or not. /""]",d you know  i dont know  for  if  youre familiar with that or not ,qy^d,MALE,16
"['no,  /']",no  ,nn,FEMALE,13
"[""i'm not. /""]",im not ,sd,FEMALE,1
"['a, {f uh, } fellow <breathing> when he was much younger, {f uh, } was tried and convicted and sentenced to death.  /']",a f uh  fellow breathing when he was much younger f uh  was tried and convicted and sentenced to death  ,sd,MALE,1
"['fortunately, in his case, the death penalty was revoked  /']",fortunately in his case the death penalty was revoked  ,sd,MALE,1
"['[ {c and, } + {f uh, } {c so } ] he served out [ his, + his ] sentence until it was discovered by a fellow who was making a documentary called the thin blue line that this guy had basically gotten railroaded through the judicial system.  /']", c and   f uh  c so   he served out  his  his  sentence until it was discovered by a fellow who was making a documentary called the thin blue line that this guy had basically gotten railroaded through the judicial system  ,sd,MALE,1
['the case was reopened  /'],the case was reopened  ,sd,MALE,1
['{c and } he was exonerated. /'],c and  he was exonerated ,sd,MALE,1
"['{d well, } {e i mean, } i think that there are many cases in our judicial system where justice is not served. /']",d well  e i mean  i think that there are many cases in our judicial system where justice is not served ,sv,FEMALE,3
"['yeah,  /']",yeah  ,aa,MALE,4
"['many laws, but little justice. /']",many laws but little justice ,sv,MALE,3
"['say, - /']",say  ,%,FEMALE,5
"['{c but, } {f uh, } - /']",c but  f uh   ,%,FEMALE,5
"['{c and } i also think, just like you were talking about before, why you were chosen to be on a jury that, {f uh, } [ [ the, + just, ] + the ] process of picking jurors is not always objective. /']",c and  i also think just like you were talking about before why you were chosen to be on a jury that f uh    the  just   the  process of picking jurors is not always objective ,sv,FEMALE,3
"['{f oh, } certainly not,  /']",f oh  certainly not  ,aa,MALE,4
['certainly not.  /'],certainly not  ,aa,MALE,4
"[""{c and } <breathing>, {d you know, } they like to think that they're getting someone who's objective in all this,  /""]",c and  breathing d you know  they like to think that theyre getting someone whos objective in all this  ,sv,MALE,3
"[""{c but } they're really looking for someone who will pretty much fulfill the lawyers' desires.  /""]",c but  theyre really looking for someone who will pretty much fulfill the lawyers desires  ,sv,MALE,3
"['{d you know, } the, - /']",d you know  the  ,%,MALE,5
['{c because } you get up  /'],c because  you get up  ,sd,MALE,1
"['[ {c and, } + {c and } ] <breathing> they ask you a few questions,  /']", c and   c and   breathing they ask you a few questions  ,sd,MALE,1
"['both sides do,  /']",both sides do  ,sd,MALE,1
"[""{c and <breathing> then } [ you, + you're ] either challenged which is, - /""]",c and breathing then   you  youre  either challenged which is  ,sd,MALE,1
"['{d you know, } each attorney can use that as much as they like  /']",d you know  each attorney can use that as much as they like  ,sd,MALE,1
"[""{c or, } i think it's a limit now,  /""]",c or  i think its a limit now  ,sd,MALE,1
"['they probably have a limit now,  /']",they probably have a limit now  ,sv,MALE,3
"['{c but, } they pretty much go through that,  /']",c but  they pretty much go through that  ,sd,MALE,1
"[""{c and then } you have to give a reason to the court why you can't serve.  /""]",c and then  you have to give a reason to the court why you cant serve  ,sd,MALE,1
"['for me, it was financial hardship,  /']",for me it was financial hardship  ,sd,MALE,1
"['[ {c so. } + {c but, } ] onto the thing, {f uh, } i was never aware that juries had any say on recommending sentencing.  /']", c so   c but   onto the thing f uh  i was never aware that juries had any say on recommending sentencing  ,sd,MALE,1
"['it was always my impression that the justice himself, or herself, had the final say. /']",it was always my impression that the justice himself or herself had the final say ,sd,MALE,1
