utterance,utterance_no_specialchar,da_tag,speaker_sex,da_category
"['{d well } what kind of car, {f uh, }  are you thinking of buying next? /']",d well  what kind of car f uh   are you thinking of buying next ,qw,MALE,12
"[""{f uh, } more than likely, it's going to be a chrysler. /""]",f uh  more than likely its going to be a chrysler ,sd,MALE,1
"['you like the chrysler products, do you? /']",you like the chrysler products do you ,qy,MALE,7
"['{f uh, } chrysler lebaron,  /']",f uh  chrysler lebaron  ,na,MALE,21
['yeah.  /'],yeah  ,ny,MALE,9
"[""it won't be a ford.  /""]",it wont be a ford  ,sd,MALE,1
"[""i've got a ford mustang now,  /""]",ive got a ford mustang now  ,sd,MALE,1
['{c and } i hate it. /'],c and  i hate it ,sd,MALE,1
['do you really? /'],do you really ,bh,MALE,18
['<laughter> yeah. /'],laughter yeah ,ny,MALE,9
['what year is it? /'],what year is it ,qw,MALE,12
"[""it's a eighty-eight. /""]",its a eightyeight ,sd,MALE,1
"[""{c and } why don't you like the mustang? /""]",c and  why dont you like the mustang ,qw,MALE,12
"[""it's, {f um, } - /""]",its f um   ,%,MALE,5
"[""i've had one problem with it after the other. /""]",ive had one problem with it after the other ,sd,MALE,1
"[""i'll be darned. /""]",ill be darned ,ba,MALE,6
"['[ the pa-, +  the paints ] peeling off of it,  /']", the pa   the paints  peeling off of it  ,sd,MALE,1
"['{d well, } you know the old sayings  about fords, what they stand for. /']",d well  you know the old sayings  about fords what they stand for ,"fo_o_fw_""_by_bc",MALE,0
['there you go. /'],there you go ,aa,MALE,4
"['-- or find them [ re-, +  road ] dead. /']", or find them  re   road  dead ,+,MALE,0
"['<laughter> {d well, } {f uh. } -/']",laughter d well  f uh  ,%,MALE,5
"['that, {f uh, } - /']",that f uh   ,%,MALE,5
"['i, {f uh, } - /']",i f uh   ,%,MALE,5
"[""it's, - /""]",its  ,%,MALE,5
"['my electrical system shorted out {d like } two or three times,  /']",my electrical system shorted out d like  two or three times  ,sd,MALE,1
"[""{c and } it's been torn up since april,  /""]",c and  its been torn up since april  ,sd,MALE,1
"['[ {c and } +  [ i, + ] {c and } ] luckily, everything was under warranty,  /']", c and     i   c and   luckily everything was under warranty  ,sd,MALE,1
"[""{c so } it's only costing  {d like } a hundred and forty dollars to get it fixed.  /""]",c so  its only costing  d like  a hundred and forty dollars to get it fixed  ,sd,MALE,1
['it would have been {d like } two thousand <laughter>. /'],it would have been d like  two thousand laughter ,sd,MALE,1
"[""{d well, } [ we've always, + {f uh, } we've always ]  had oldsmobiles, and, {f uh, } been very, {f uh, } happy with oldsmobiles,  /""]",d well   weve always  f uh  weve always   had oldsmobiles and f uh  been very f uh  happy with oldsmobiles  ,sd,MALE,1
"['{c but, }  {f uh, } my wife thought she wanted to get a ford mustang  /']",c but   f uh  my wife thought she wanted to get a ford mustang  ,sd,MALE,1
"['{c and then } she kind of changed her mind  and thinks her next car ought to be one of those, {f uh, } mitsubishi eclipses.  /']",c and then  she kind of changed her mind  and thinks her next car ought to be one of those f uh  mitsubishi eclipses  ,sd,MALE,1
"['[ she real-, +']", she real ,sd,MALE,1
"['[ those, +  those ] are nice cars. /']", those   those  are nice cars ,sv,MALE,3
"['she ] [ likes, +  {f uh, } likes ] those.  /']",she   likes   f uh  likes  those  ,+,MALE,0
"['she has a sister that lives in, {f uh, } phoenix that has one and, {f uh, } really, {f uh, } enjoys it.  /']",she has a sister that lives in f uh  phoenix that has one and f uh  really f uh  enjoys it  ,sd,MALE,1
"['{d well, } [ what, +  {f uh, } what ] things do you consider when you buy a car? /']",d well   what   f uh  what  things do you consider when you buy a car ,qw,MALE,12
"['{f um, } the gas mileage for one thing,  /']",f um  the gas mileage for one thing  ,sd,MALE,1
"[""{c and } [ [ i've, +  i've, ] +  i've ] always had {d like } stick shift.  /""]",c and    ive   ive    ive  always had d like  stick shift  ,sd,MALE,1
"['[ i want to, + the next car i get i want it to ] be automatic. /']", i want to  the next car i get i want it to  be automatic ,sd,MALE,1
['i see. /'],i see ,bk,MALE,14
"['[ [ i, +  {f uh, } i, ] +  i ]  hate driving anyway,  /']",  i   f uh  i    i   hate driving anyway  ,sd,MALE,1
"['[ {c and } then, +  {c and } ] changing gears at stop lights and stuff is really getting on my nerves now. /']", c and  then   c and   changing gears at stop lights and stuff is really getting on my nerves now ,sd,MALE,1
"['yeah,  /']",yeah  ,aa,MALE,4
"[""especially when you're in high traffic areas --""]",especially when youre in high traffic areas ,sv,MALE,3
['yeah. /'],yeah ,b,MALE,2
['-- and have to mess with that all the time. -/'], and have to mess with that all the time ,+,MALE,0
"[""{c and, } {d you know, } when you work  nine to five, or eight to five, and you're in rush hour traffic to and from work, unfortunately. /""]",c and  d you know  when you work  nine to five or eight to five and youre in rush hour traffic to and from work unfortunately ,sd,MALE,1
['that makes it very frustrating. /'],that makes it very frustrating ,bf,MALE,20
"['{c and } i look, - /']",c and  i look  ,sd,MALE,1
"['{c and } one of the  things with chrysler right now [ is, +  is ] [ their, +  the ] warranties that they have,  /']",c and  one of the  things with chrysler right now  is   is   their   the  warranties that they have  ,sd,MALE,1
"['{c and } [ i, +  i ]  feel like their, - /']",c and   i   i   feel like their  ,%,MALE,5
"[""everybody i've talked to that owns one, [ [ has, +  has, ] +  has ]  been real pleased with it,  /""]",everybody ive talked to that owns one   has   has    has   been real pleased with it  ,sd,MALE,1
"[""{c and } i like [ the, +  the ] driver's air bag,  /""]",c and  i like  the   the  drivers air bag  ,sd,MALE,1
['i like that. /'],i like that ,sd,MALE,1
['now this is a lebaron? /'],now this is a lebaron ,qy^d,MALE,16
"['{f uh, } yeah,  /']",f uh  yeah  ,ny,MALE,9
"['{d well } all chrysler  products has it in there,  /']",d well  all chrysler  products has it in there  ,sd,MALE,1
"['{c but } lebaron would be the next car i get,  /']",c but  lebaron would be the next car i get  ,sd,MALE,1
['yeah. /'],yeah ,%,MALE,5
"['i sure like [ the, +  {f uh, } [ convertible, + ]  those ] rag top lebarons,  /']",i sure like  the   f uh   convertible    those  rag top lebarons  ,sd,MALE,1
['they really look sporty. /'],they really look sporty ,sv,MALE,3
"['yeah,  /']",yeah  ,aa,MALE,4
"['yeah,  /']",yeah  ,aa,MALE,4
"['[ i like, +  i like ]  that too, {f huh, }  /']", i like   i like   that too f huh   ,sd,MALE,1
"[""{c but, }  {f uh, }  [ i, +  i ] couldn't afford the insurance on one of those <laughter>. /""]",c but   f uh    i   i  couldnt afford the insurance on one of those laughter ,sd,MALE,1
"['<laughter> {d well, } {f uh, } we always, - /']",laughter d well  f uh  we always  ,sd,MALE,1
"[""this last oldsmobile we bought, {f uh, } it's an eighty-seven,  /""]",this last oldsmobile we bought f uh  its an eightyseven  ,sd,MALE,1
"['{c but } we bought it in eighty-eight,  {d you know, } right at the end of the year when they were trying to get rid of them -- /']",c but  we bought it in eightyeight  d you know  right at the end of the year when they were trying to get rid of them  ,sd,MALE,1
['yeah. /'],yeah ,b,MALE,2
"['-- {c and, }  {f uh, } [ we found that, +   {f uh, } we found ] a real good interest rate,  /']", c and   f uh   we found that    f uh  we found  a real good interest rate  ,sd,MALE,1
"[""{d you know, } when they're trying to get rid of those cars at the end of the year like  that, they really come down on their prices  /""]",d you know  when theyre trying to get rid of those cars at the end of the year like  that they really come down on their prices  ,sd,MALE,1
"['{c and, }  {f uh, } {f uh, } {d you know, } we looked around at used cars,  /']",c and   f uh  f uh  d you know  we looked around at used cars  ,sd,MALE,1
"[""{c and } we really couldn't,  {f uh, } afford the payments on a used car,  /""]",c and  we really couldnt  f uh  afford the payments on a used car  ,sd,MALE,1
"['{c because, } {f uh, } if you go to the bank and try to get a loan, they want to charge twelve, thirteen percent, {d you know, }  /']",c because  f uh  if you go to the bank and try to get a loan they want to charge twelve thirteen percent d you know   ,sd,MALE,1
"['{c and } we ended up, i think, with {d like }  a four and a half percent interest rate on a  brand new car, and the payments. /']",c and  we ended up i think with d like   a four and a half percent interest rate on a  brand new car and the payments ,sd,MALE,1
"[""{d well, } that's what i'm paying on mine now.  /""]",d well  thats what im paying on mine now  ,sd,MALE,1
"['i had to get {d like } a first time, - /']",i had to get d like  a first time  ,sd,MALE,1
"[""my dad's always cosigned [ on, +  on ] [ my, +  my ]  loans, or whatever,  /""]",my dads always cosigned  on   on   my   my   loans or whatever  ,sd,MALE,1
"['{c and } this is one, when i bought,  /']",c and  this is one when i bought  ,sd,MALE,1
"['i got my mustang this time [ was + ]  by myself, because i got on my own, or whatever,  /']",i got my mustang this time  was    by myself because i got on my own or whatever  ,sd,MALE,1
"['{c and, }  {f um, } i had said, - /']",c and   f um  i had said  ,sd,MALE,1
"[""[ they, +  they ] said it had to be {d like } a first time buyer's car or whatever,  /""]", they   they  said it had to be d like  a first time buyers car or whatever  ,sd,MALE,1
"[""{c and } they're charging me unreasonable  ((   )) interest,  /""]",c and  theyre charging me unreasonable      interest  ,sd,MALE,1
"[""{c but } <inhaling> i've got  eight more payments  /""]",c but  inhaling ive got  eight more payments  ,sd,MALE,1
"[""{c and } it's paid for. /""]",c and  its paid for ,sd,MALE,1
"[""{d well, } that's great. /""]",d well  thats great ,ba,MALE,6
"['{c but } [ i got it when, + i got it when ]  the eighty-eights first came out,  /']",c but   i got it when  i got it when   the eightyeights first came out  ,sd,MALE,1
"[""[ [ it's a, +  it's, ] +  it's a ] good car, {e i mean, }   i got in eighty-seven, i guess, in {d like } november or something like that,  /""]",  its a   its    its a  good car e i mean    i got in eightyseven i guess in d like  november or something like that  ,sd,MALE,1
['{c and. } -/'],c and  ,%,MALE,5
['uh-huh.  /'],uhhuh  ,b,MALE,2
"['{d well, } when our kids were younger we really wanted a two door.  /']",d well  when our kids were younger we really wanted a two door  ,sd,MALE,1
['our first car was an oldsmobile back in seventy-seven.  /'],our first car was an oldsmobile back in seventyseven  ,sd,MALE,1
"['it was a two door cutlass supreme,  /']",it was a two door cutlass supreme  ,sd,MALE,1
"['{c and, }  {f uh, } it just happened  that when we looked for [ our, +  our ] new car, they had a thing going with oldsmobile  /']",c and   f uh  it just happened  that when we looked for  our   our  new car they had a thing going with oldsmobile  ,sd,MALE,1
"[""{c and } if you'd buy [ a, +  a ] new oldsmobile they'd give you four hundred rebate,  because it was their seventy-fifth anniversary. /""]",c and  if youd buy  a   a  new oldsmobile theyd give you four hundred rebate  because it was their seventyfifth anniversary ,sd,MALE,1
['uh-huh. /'],uhhuh ,b,MALE,2
"['i belie-,  /']",i belie  ,%,MALE,5
['yeah  /'],yeah  ,b,MALE,2
['seventy-fifth anniversary.  /'],seventyfifth anniversary  ,sd,MALE,1
"['{c so  } in addition to everything else we got off the car,   all we had to do is show them our, {f uh, } papers on our first car,  /']",c so   in addition to everything else we got off the car   all we had to do is show them our f uh  papers on our first car  ,sd,MALE,1
['{c and } they gave us another four  hundred dollars off on it.  /'],c and  they gave us another four  hundred dollars off on it  ,sd,MALE,1
"['{c so } [ we, +  we ] got a four door this time,  /']",c so   we   we  got a four door this time  ,sd,MALE,1
"['{c and } i sort of went more for [ the, +  {f uh, } the ] comfort factor,  /']",c and  i sort of went more for  the   f uh  the  comfort factor  ,sd,MALE,1
"['{c and, }  {f uh, } i liked the smaller cars,  /']",c and   f uh  i liked the smaller cars  ,sd,MALE,1
"[""{c but } i'm a bigger person,  /""]",c but  im a bigger person  ,sd,MALE,1
"['{c and } [ i, +  i ] really like comfort, {d you know, } driving along the road and stuff. /']",c and   i   i  really like comfort d you know  driving along the road and stuff ,sd,MALE,1
"[""{d well, } that's another big factor of mine.  /""]",d well  thats another big factor of mine  ,sd,MALE,1
"[""[ next, +  next ] car i get's going to be a four door too.  something with some room. /""]", next   next  car i gets going to be a four door too  something with some room ,sd,MALE,1
['yeah. /'],yeah ,b,MALE,2
"['{c because } [ i, +  {f uh, } my ] mustang  [ [ is, +  is, ] +  is ] two door with bucket seats,  /']",c because   i   f uh  my  mustang    is   is    is  two door with bucket seats  ,sd,MALE,1
['{c and } you buy groceries and stuff like that. /'],c and  you buy groceries and stuff like that ,sd,MALE,1
"['{c and } if you try to take anybody, {d you know, } go to the show or go out for supper, and you go as a foursome, -/']",c and  if you try to take anybody d you know  go to the show or go out for supper and you go as a foursome ,sd,MALE,1
