utterance,utterance_no_specialchar,da_tag,speaker_sex,da_category
"['{f uh, } {d so } what do you do to exercise? /']",f uh  d so  what do you do to exercise ,qw,MALE,12
"['{f uh, } s-, - /']",f uh  s  ,%,MALE,5
"['i, {f uh, } weight train, {f uh, } three days on and one day off. /']",i f uh  weight train f uh  three days on and one day off ,sd,MALE,1
['uh-huh. /'],uhhuh ,bk,MALE,14
"[""i, {f uh, } ride bicycles, <breathing>, {f uh, } fifteen, twenty miles, i don't know, maybe three times, maybe four times a week.  /""]",i f uh  ride bicycles breathing f uh  fifteen twenty miles i dont know maybe three times maybe four times a week  ,sd,MALE,1
"['i play basketball, {f uh, } couple times a week.  /']",i play basketball f uh  couple times a week  ,sd,MALE,1
['i play softball one night a week.   /'],i play softball one night a week   ,sd,MALE,1
"[""{f uh, } that's what i do. /""]",f uh  thats what i do ,sd,MALE,1
['{f um. } /'],f um  ,%,MALE,5
['what about yourself? /'],what about yourself ,qo,MALE,25
"[""that's pretty impressive.   /""]",thats pretty impressive   ,sv,MALE,3
"['{f uh, } i guess i bicycle.  /']",f uh  i guess i bicycle  ,sd,MALE,1
"['{f uh, } the amount varies  /']",f uh  the amount varies  ,sd,MALE,1
['as much as a hundred  and fifty miles a week. /'],as much as a hundred  and fifty miles a week ,sd,MALE,1
['uh-huh. /'],uhhuh ,bk,MALE,14
"['{f uh, } i guess a play softball one night a week.   /']",f uh  i guess a play softball one night a week   ,sd,MALE,1
['{c and } i backpack a lot over the summer. /'],c and  i backpack a lot over the summer ,sd,MALE,1
"['{f oh, } really? /']",f oh  really ,bh,MALE,18
"['yeah,  /']",yeah  ,ny,MALE,9
"[""[ that's, +  that's ] about the extent of it.  /""]", thats   thats  about the extent of it  ,sd,MALE,1
"[""{e i mean, } i don't do any of those things particularly, {d you know, } for exercise.  /""]",e i mean  i dont do any of those things particularly d you know  for exercise  ,sd,MALE,1
"[""{c but, } {f uh, } i guess the bicycling is the one thing i'll sort of, {d like, } do if i feel like i need to go exercise <breathing>.  /""]",c but  f uh  i guess the bicycling is the one thing ill sort of d like  do if i feel like i need to go exercise breathing  ,sd,MALE,1
"['{f uh, } {c but } i do it mostly for fun. /']",f uh  c but  i do it mostly for fun ,sd,MALE,1
"['yeah,  /']",yeah  ,b,MALE,2
"['{f uh, } what do you ride, {f uh, } {d like, } a bunch of hills or  pretty flat? /']",f uh  what do you ride f uh  d like  a bunch of hills or  pretty flat ,qy,MALE,7
"['[ [ it, +  it, ] +  it ] varies.  /']",  it   it    it  varies  ,sd,MALE,1
"['{f uh, } out near my house is pretty hilly.  /']",f uh  out near my house is pretty hilly  ,sd,MALE,1
"['{f uh, } {c but } sometimes i bike to work which is about, {f uh, } a fifteen mile trip each way.  /']",f uh  c but  sometimes i bike to work which is about f uh  a fifteen mile trip each way  ,sd,MALE,1
"[""{c and } that's mostly flat. /""]",c and  thats mostly flat ,sd,MALE,1
['how long does that take you to get to work? /'],how long does that take you to get to work ,qw,MALE,12
"['{f uh, } about forty-five, fifty minutes. /']",f uh  about fortyfive fifty minutes ,sd,MALE,1
"['[ how d-, + how does ] that [ work, + work ] out with, {f uh, } storing your bike and showering and all that? /']", how d  how does  that  work  work  out with f uh  storing your bike and showering and all that ,qw,MALE,12
"['yeah,  /']",yeah  ,b,MALE,2
['it can be a pain.  /'],it can be a pain  ,sd,MALE,1
"['{f uh, } basically, {f uh, } i work on a campus  /']",f uh  basically f uh  i work on a campus  ,sd,MALE,1
"['{c so } i can store my bike in my office and walk across the, {f uh, } campus to the, {f uh, } gym, use the shower there -- /']",c so  i can store my bike in my office and walk across the f uh  campus to the f uh  gym use the shower there  ,sd,MALE,1
['uh-huh. /'],uhhuh ,b,MALE,2
"[""-- {f uh, } {c but, } [ it's, +  it's ] enough of a pain, that i did it consistently one year,  /""]", f uh  c but   its   its  enough of a pain that i did it consistently one year  ,sd,MALE,1
"['i would commute every day, {f uh, }  /']",i would commute every day f uh   ,sd,MALE,1
['{c but } it just became such a pain.  /'],c but  it just became such a pain  ,sd,MALE,1
"[""{e i mean } we're talking, {d you know, } forty-five, fifty minutes for biking,""]",e i mean  were talking d you know  fortyfive fifty minutes for biking,sd,MALE,1
['right. /'],right ,b,MALE,2
"['{f uh, } and sometimes longer if you had adverse wind. and then another half an hour, {d you know } to cool down and take a shower and all this kind of stuff.   /']",f uh  and sometimes longer if you had adverse wind and then another half an hour d you know  to cool down and take a shower and all this kind of stuff   ,+,MALE,0
"['it was a big [ hunk, + hunk ] of the day <breathing>.  /']",it was a big  hunk  hunk  of the day breathing  ,sd,MALE,1
"['{f uh, } {c and then } of course another hour to get back home.  /']",f uh  c and then  of course another hour to get back home  ,sd,MALE,1
"[""{f uh, } {c so } i've been doing that less, [ and, + and ] concentrating more on, {d you know, } light biking when i get home on the evening and then, {d you know, } some more on the weekends. /""]",f uh  c so  ive been doing that less  and  and  concentrating more on d you know  light biking when i get home on the evening and then d you know  some more on the weekends ,sd,MALE,1
['yeah.  /'],yeah  ,b,MALE,2
['do you ride a lot of rallies or a lot of those around there? /'],do you ride a lot of rallies or a lot of those around there ,qy,MALE,7
['not so much.  /'],not so much  ,ng,MALE,29
"['{f uh, } i guess mostly i bike on my own.  /']",f uh  i guess mostly i bike on my own  ,sd,MALE,1
"[""i've got a touring bike.""]",ive got a touring bike,sd,MALE,1
['uh-huh. /'],uhhuh ,b,MALE,2
"[""{f uh, } though i haven't gone on any extended trips with it.  /""]",f uh  though i havent gone on any extended trips with it  ,+,MALE,0
"['how about you,  /']",how about you  ,qo,MALE,25
['what kind of biking do you do? /'],what kind of biking do you do ,qw,MALE,12
"['{f uh, } {d well, } actually my wife just got me into it  /']",f uh  d well  actually my wife just got me into it  ,^h,MALE,27
"['{c and } i [ did an, + did an ] internship at the institute for aerobics research in dallas,']",c and  i  did an  did an  internship at the institute for aerobics research in dallas,sd,MALE,1
['uh-huh. /'],uhhuh ,b,MALE,2
"['the cooper clinic,  /']",the cooper clinic  ,+,MALE,0
"['{c and } i learned all the health benefits of, {d you know, } - /']",c and  i learned all the health benefits of d you know   ,sd,MALE,1
"['i was a solid weight trainer, /']",i was a solid weight trainer ,sd,MALE,1
['uh-huh. /'],uhhuh ,b,MALE,2
['{c and } all i did was weights and aerobic exercise  /'],c and  all i did was weights and aerobic exercise  ,sd,MALE,1
"['{c and then } my wife got me into the aerobic exercise and said you really need to do it,  /']",c and then  my wife got me into the aerobic exercise and said you really need to do it  ,sd,MALE,1
"['{c so, }']",c so ,sd,MALE,1
['uh-huh. /'],uhhuh ,b,MALE,2
"['once i got into this, {f uh, } internship, i learned all the physiological [ [ ad-, + advan-, ] + advantages ] to it,  /']",once i got into this f uh  internship i learned all the physiological   ad  advan   advantages  to it  ,+,MALE,0
"[""{c so } i began a program [ couple, + i don't know probably three or four ] weeks ago  /""]",c so  i began a program  couple  i dont know probably three or four  weeks ago  ,sd,MALE,1
['{c and } i did my first bike rally this saturday.  /'],c and  i did my first bike rally this saturday  ,sd,MALE,1
"['i did, {f uh, } [ forty, + forty ] miles, /']",i did f uh   forty  forty  miles ,sd,MALE,1
['{f um. } /'],f um  ,%,MALE,5
"[""{c and, } {f uh, } that's the longest i've ever ridden so far,  /""]",c and  f uh  thats the longest ive ever ridden so far  ,sd,MALE,1
"['i usually, {d you know, } fifteen or twenty. /']",i usually d you know  fifteen or twenty ,sd,MALE,1
['uh-huh. /'],uhhuh ,b,MALE,2
"['{c and } [ it was, + it was ] kind of hilly  /']",c and   it was  it was  kind of hilly  ,sd,MALE,1
"['{c and } it was pretty tough,  /']",c and  it was pretty tough  ,sd,MALE,1
"[""{c but, } {f uh, } i'm looking at, {f uh, } doing a lot more of it because, {d you know, } my wife is really into it, /""]",c but  f uh  im looking at f uh  doing a lot more of it because d you know  my wife is really into it ,sd,MALE,1
"['{f oh, } i see. /']",f oh  i see ,b,MALE,2
"['{c and } [ i, + i ] kind of held her back a little bit [ this, +  this ] weekend.  /']",c and   i  i  kind of held her back a little bit  this   this  weekend  ,sd,MALE,1
"['she wanted to go, go, go,  /']",she wanted to go go go  ,sd,MALE,1
"['{c but, }']",c but ,sd,MALE,1
['uh-huh. /'],uhhuh ,b,MALE,2
"['{d you know, } she wanted to stay with me <breathing>. /']",d you know  she wanted to stay with me breathing ,+,MALE,0
"[""it's good to have a partner. /""]",its good to have a partner ,sv,MALE,3
['yeah  /'],yeah  ,aa,MALE,4
['it really is. /'],it really is ,aa,MALE,4
"['are you think of doing any, {d like, } centuries, or ... -/']",are you think of doing any d like  centuries or  ,qy,MALE,7
"['yeah,  /']",yeah  ,ny,MALE,9
"['that would be cool sometime if i could, {d you know, } work up to that. /']",that would be cool sometime if i could d you know  work up to that ,sv,MALE,3
['uh-huh.  /'],uhhuh  ,b,MALE,2
"['yeah,  /']",yeah  ,b,MALE,2
"['i just wondered if you were going to do that mostly or more like, {d you know, } {f uh, } <breathing> {f uh, } touring {d like } from vermont or, {d you know, } that kind of,']",i just wondered if you were going to do that mostly or more like d you know  f uh  breathing f uh  touring d like  from vermont or d you know  that kind of,qy,MALE,7
['oh. /'],oh ,b,MALE,2
['thing.  /'],thing  ,+,MALE,0
['i mean people seem to get into different aspects.  /'],i mean people seem to get into different aspects  ,sv,MALE,3
"['one is more of a distance, - /']",one is more of a distance  ,sv,MALE,3
"[""{c and } one's more, just, {d you know, } - /""]",c and  ones more just d you know   ,sv,MALE,3
['they want to put some equipment on their bike and go for a tour. /'],they want to put some equipment on their bike and go for a tour ,sv,MALE,3
"[""i've never really looked into that.  /""]",ive never really looked into that  ,sd,MALE,1
"[""[ that, + {d you know, } that's, ] - /""]", that  d you know  thats   ,%,MALE,5
['my wife would just love that. /'],my wife would just love that ,sd,MALE,1
['uh-huh. /'],uhhuh ,b,MALE,2
['{c and } i may do that sometime.  /'],c and  i may do that sometime  ,sd,MALE,1
"[""there again, i'm just kind of a fledgling into this. /""]",there again im just kind of a fledgling into this ,sd,MALE,1
['uh-huh. /'],uhhuh ,b,MALE,2
"[""[ i've, + it's ] kind of funny.  /""]", ive  its  kind of funny  ,sv,MALE,3
['i called this number  /'],i called this number  ,sd,MALE,1
['{c and } i was just reading through a bicycle magazine and going through all the different tours coming up. /'],c and  i was just reading through a bicycle magazine and going through all the different tours coming up ,sd,MALE,1
"['yeah,  /']",yeah  ,b,MALE,2
['yeah. /'],yeah ,b,MALE,2
"['{e i mean, } around texas, [ you, +  you ] got about five or six,  /']",e i mean  around texas  you   you  got about five or six  ,sd,MALE,1
"['if you live around the dallas area, you got five or six every weekend to choose from.']",if you live around the dallas area you got five or six every weekend to choose from,sd,MALE,1
"[""{f oh, } that's nice. /""]",f oh  thats nice ,ba,MALE,6
"[""because they're really into it. /""]",because theyre really into it ,+,MALE,0
['{f um. } /'],f um  ,%,MALE,5
['bicycling is really big here.  /'],bicycling is really big here  ,sd,MALE,1
"[""i didn't know that, [ and, + ] {d you know, } until i came down here, and,""]",i didnt know that  and   d you know  until i came down here and,sd,MALE,1
['wow. /'],wow ,ba,MALE,6
['kind of caught the fever. /'],kind of caught the fever ,+,MALE,0
['yeah. /'],yeah ,b,MALE,2
['{c because } i lived in indiana all my life  /'],c because  i lived in indiana all my life  ,sd,MALE,1
"['{c and, } {d you know, } you may say see one or two guys on a bicycle [ that, + {e or } ] above the age of fifteen or something, -- /']",c and  d you know  you may say see one or two guys on a bicycle  that  e or   above the age of fifteen or something  ,sd,MALE,1
['uh-huh. /'],uhhuh ,b,MALE,2
"[""-- {c but, } other than that it's nothing up there like it is down here. /""]", c but  other than that its nothing up there like it is down here ,sd,MALE,1
"['yeah,  /']",yeah  ,b,MALE,2
"[""i'm not sure why that is.  /""]",im not sure why that is  ,sd,MALE,1
"['{e i mean, }  generally in the midwest it seems to be [ less, + much less. ]  /']",e i mean   generally in the midwest it seems to be  less  much less   ,sv,MALE,3
"[""{e i mean, } maybe it's because of the winters.""]",e i mean  maybe its because of the winters,sv,MALE,3
['probably. /'],probably ,aa,MALE,4
"[""{f uh, } or maybe just because, {d you know, } [ there's, + there's ] a lot more flat lands, {d you know, } out in the west. /""]",f uh  or maybe just because d you know   theres  theres  a lot more flat lands d you know  out in the west ,+,MALE,0
['yeah. /'],yeah ,b,MALE,2
['{c so } it makes biking a better alternative for transportation. /'],c so  it makes biking a better alternative for transportation ,sv,MALE,3
['yeah.  /'],yeah  ,b,MALE,2
"[""[ it, + there's ] a lot of bikers around here.  /""]", it  theres  a lot of bikers around here  ,sd,MALE,1
"[""[ it's, + it's ] really neat. /""]", its  its  really neat ,sv,MALE,3
['uh-huh. /'],uhhuh ,b,MALE,2
"['there are [ a lot of, + a lot of ] resources, a lot of magazines, and stuff,  /']",there are  a lot of  a lot of  resources a lot of magazines and stuff  ,sd,MALE,1
"['little texas bicyclist, is {d like } a little newspaper that comes out every month. /']",little texas bicyclist is d like  a little newspaper that comes out every month ,sd,MALE,1
['{f um. } /'],f um  ,%,MALE,5
"[""it's free  /""]",its free  ,sd,MALE,1
"['just go to the [ bike shock, + [ bi-, + bike ] shop ] and pick it up,  /']",just go to the  bike shock   bi  bike  shop  and pick it up  ,ad,MALE,22
"[""{c and } it's got all the rides coming up,  /""]",c and  its got all the rides coming up  ,sd,MALE,1
"[""{c so } i guess i'm going to be busy about every saturday this summer,""]",c so  i guess im going to be busy about every saturday this summer,sd,MALE,1
"[""{f oh, } that's terrific. /""]",f oh  thats terrific ,ba,MALE,6
['going to a different ride.  /'],going to a different ride  ,+,MALE,0
"['yeah,  /']",yeah  ,%,MALE,5
"[""see a little bit of texas i've never seen before. /""]",see a little bit of texas ive never seen before ,sd,MALE,1
['uh-huh. /'],uhhuh ,b,MALE,2
"['{c so, } {f uh, } how long have you been biking? /']",c so  f uh  how long have you been biking ,qw,MALE,12
"['{f oh, } i guess as an adult for just about the past, {f uh, } three years or so <breathing>.  /']",f oh  i guess as an adult for just about the past f uh  three years or so breathing  ,sd,MALE,1
"['{f uh, } {d you know, } i guess last time i did it before that was college, which was about ten years ago. /']",f uh  d you know  i guess last time i did it before that was college which was about ten years ago ,sd,MALE,1
['yeah. /'],yeah ,bk,MALE,14
"['{c and, } {f uh, } yeah,  /']",c and  f uh  yeah  ,b,MALE,2
"['i guess i just never really thought about it much for a while, {f uh, } until i suddenly discovered all my friends were basically biking a lot.  /']",i guess i just never really thought about it much for a while f uh  until i suddenly discovered all my friends were basically biking a lot  ,sd,MALE,1
"[""{c and so } i thought i'd try it, too. /""]",c and so  i thought id try it too ,sd,MALE,1
"[""have [ you ever had a, + {f uh, } {a it's kind of slightly off the subject, but } you ever had [ a, + {f uh, } a ] ] blood workup done recently or since you've been biking,""]",have  you ever had a  f uh  a its kind of slightly off the subject but  you ever had  a  f uh  a   blood workup done recently or since youve been biking,qy,MALE,7
"['no,  /']",no  ,nn,MALE,13
"[""i haven't,  /""]",i havent  ,sd,MALE,1
['no. /'],no ,nn,MALE,13
"['to see if it, - /']",to see if it  ,+,MALE,0
"['{c because } [ it really, + from what i understand, it really ] improves your, {f uh, } cholesterol -- /']",c because   it really  from what i understand it really  improves your f uh  cholesterol  ,sv,MALE,3
['{f um. } /'],f um  ,%,MALE,5
"['-- {c and, } {d you know, } [ it, + {f uh, } <breathing> it ] kind of knocks down two of the big risk categories for coronary artery disease which is, {f uh, } {f uh, } low cardiovascular fitness, and also, {f uh, } {d you know, } the cholesterol. /']", c and  d you know   it  f uh  breathing it  kind of knocks down two of the big risk categories for coronary artery disease which is f uh  f uh  low cardiovascular fitness and also f uh  d you know  the cholesterol ,sd,MALE,1
['uh-huh. /'],uhhuh ,b,MALE,2
['it gives you increased h d ls and decreases your l d ls. /'],it gives you increased h d ls and decreases your l d ls ,sd,MALE,1
"[""{f oh, } that's great. /""]",f oh  thats great ,ba,MALE,6
"['yeah,  /']",yeah  ,b,MALE,2
['{c so } ... -/'],c so   ,%,MALE,5
"['yeah,  /']",yeah  ,b,MALE,2
"[""[ i've, +  i've ] definitely noticed it's had a good effect on [ my pulse rate, +  my resting pulse. ] /""]", ive   ive  definitely noticed its had a good effect on  my pulse rate   my resting pulse  ,sd,MALE,1
['yeah. /'],yeah ,b,MALE,2
"['{d you know, } it gets it down to about forty. /']",d you know  it gets it down to about forty ,sd,MALE,1
['really? /'],really ,bh,MALE,18
['yeah. /'],yeah ,ny,MALE,9
"[""that's good. /""]",thats good ,ba,MALE,6
['yeah. /'],yeah ,b,MALE,2
"['you say you ride about a hundred, hundred fifty miles a week? /']",you say you ride about a hundred hundred fifty miles a week ,qy^d,MALE,16
['yeah. /'],yeah ,ny,MALE,9
['man.  /'],man  ,ba,MALE,6
"[""[ that's, +  that's ] hard-core. /""]", thats   thats  hardcore ,sv,MALE,3
"['on average,  /']",on average  ,sd,MALE,1
['yeah. /'],yeah ,%,MALE,5
['when do you get to begin with the winters and all that?  /'],when do you get to begin with the winters and all that  ,qw,MALE,12
"['what time of the year do you usually embark on your, - /']",what time of the year do you usually embark on your  ,qw,MALE,12
"[""do you ride inside if you can't ride outside? /""]",do you ride inside if you cant ride outside ,qy,MALE,7
"['no,  /']",no  ,nn,MALE,13
"[""i'm not that hard-core.  /""]",im not that hardcore  ,sd,MALE,1
"['{e i mean } there are some people, - /']",e i mean  there are some people  ,sv,MALE,3
['in fact a lot of people will ride outside in the snow.  /'],in fact a lot of people will ride outside in the snow  ,sd,MALE,1
"[""they've got a, {f uh, } mountain bike,""]",theyve got a f uh  mountain bike,sd,MALE,1
['<laughter>.'],laughter,x,MALE,8
"['{d you know, } with the big knobby tires. /']",d you know  with the big knobby tires ,+,MALE,0
['yeah. /'],yeah ,b,MALE,2
"[""{c and, } i don't do that.  /""]",c and  i dont do that  ,sd,MALE,1
"['[ i basically, + [ i, + i ] pretty much ] lay off for the winter.  /']", i basically   i  i  pretty much  lay off for the winter  ,sd,MALE,1
"[""{f uh, } i was thinking of getting rollers for the last winter, {d you know, } because it will help your balance when you're indoor training. /""]",f uh  i was thinking of getting rollers for the last winter d you know  because it will help your balance when youre indoor training ,sd,MALE,1
['{f um. } /'],f um  ,%,MALE,5
"['{f uh, } {c but } i just, {d you know, } more or less stocked, {d like } an exercise bike and that kind of thing.  <breathing>, {f uh, }  /']",f uh  c but  i just d you know  more or less stocked d like  an exercise bike and that kind of thing  breathing f uh   ,sd,MALE,1
"['{c but, } yeah,  /']",c but  yeah  ,%,MALE,5
['{e i mean } winters are kind of a problem  /'],e i mean  winters are kind of a problem  ,sv,MALE,3
"[""{c so, } i'm more or less out of shape now that i've been biking, i guess, this year for just a couple of weeks.  /""]",c so  im more or less out of shape now that ive been biking i guess this year for just a couple of weeks  ,sd,MALE,1
['uh-huh. /'],uhhuh ,b,MALE,2
"[""{f uh, } {c but, } {d you know, } up here <laughter>, it's only stopped snowing since then. /""]",f uh  c but  d you know  up here laughter its only stopped snowing since then ,sd,MALE,1
['yeah. /'],yeah ,b,MALE,2
"['{f uh, } <lipsmack>, {c but, } yeah,  /']",f uh  lipsmack c but  yeah  ,%,MALE,5
"[""[ [ [ it's, + it's, ] + it's, ] + it's ] pretty good.  /""]",   its  its   its   its  pretty good  ,sv,MALE,3
"[""it's, {f uh, } - /""]",its f uh   ,%,MALE,5
"[""[ the main, + the main ] thing, i guess, for me is just to enjoy it because once it starts seeming like, {d you know, } exercise and a chore <laughter>, i'll lay off it more. /""]", the main  the main  thing i guess for me is just to enjoy it because once it starts seeming like d you know  exercise and a chore laughter ill lay off it more ,sd,MALE,1
['right.  /'],right  ,b,MALE,2
"['{c so } you, {f uh, } change up your routes a lot, and keep a ... -/']",c so  you f uh  change up your routes a lot and keep a  ,bf,MALE,20
"['{f oh, } yeah,  /']",f oh  yeah  ,aa,MALE,4
['yeah.  /'],yeah  ,aa,MALE,4
"['i try to go someplace pretty different, {d you know, } every week.  /']",i try to go someplace pretty different d you know  every week  ,sd,MALE,1
"['i rotate around, {f uh, } about four different routes, {f uh, } from my house  /']",i rotate around f uh  about four different routes f uh  from my house  ,sd,MALE,1
"[""{c or } i'll sometimes come in the school.  /""]",c or  ill sometimes come in the school  ,sd,MALE,1
"[""it's nice coming,  /""]",its nice coming  ,sd,MALE,1
"[""[ it's, + it's ] nice riding to school because it's all along a canal path <breathing>, {f uh, }  /""]", its  its  nice riding to school because its all along a canal path breathing f uh   ,sd,MALE,1
"[""{c because } [ it's just, + it's ] along the erie canal up here. /""]",c because   its just  its  along the erie canal up here ,sd,MALE,1
"['{d so, } what school is it? /']",d so  what school is it ,qw,MALE,12
"['{f uh, } university of rochester. /']",f uh  university of rochester ,sd,MALE,1
"['{f oh, } okay.  /']",f oh  okay  ,bk,MALE,14
['yeah. /'],yeah ,b,MALE,2
"[""{c so } it's fairly picturesque. /""]",c so  its fairly picturesque ,sv,MALE,3
['yeah. /'],yeah ,b,MALE,2
"[""[ {c and, } + {f uh, } {c so } ] [ [ it's, + it's, ] + it's ] a good ride  /""]", c and   f uh  c so     its  its   its  a good ride  ,sd,MALE,1
"[""as long as you're not doing it every day, it's a good ride <laughter>. /""]",as long as youre not doing it every day its a good ride laughter ,sv,MALE,3
['yeah.  /'],yeah  ,aa,MALE,4
"[""that's true.  /""]",thats true  ,aa,MALE,4
['sounds neat. /'],sounds neat ,ba,MALE,6
['yeah. /'],yeah ,b,MALE,2
"[""it's kind of, - /""]",its kind of  ,%,MALE,5
"[""i was wondering if i was going to talk with someone that never has exercised before and doesn't want to and  everything else,  /""]",i was wondering if i was going to talk with someone that never has exercised before and doesnt want to and  everything else  ,sd,MALE,1
['{c but } got a guy that rides a hundred and fifty miles a week.  /'],c but  got a guy that rides a hundred and fifty miles a week  ,sd,MALE,1
"[""that's, {f uh, } motivating. /""]",thats f uh  motivating ,sv,MALE,3
['yeah. /'],yeah ,b,MALE,2
"[""that's really good.  /""]",thats really good  ,sv,MALE,3
['{d well } --'],d well  ,fc,MALE,10
"['{f oh, } it was good talking to you. /']",f oh  it was good talking to you ,fc,MALE,10
['-- good talking to you  /'], good talking to you  ,+,MALE,0
['{c and } keep up the good work. /'],c and  keep up the good work ,fc,MALE,10
"['okay,  /']",okay  ,fc,MALE,10
"['you, too. /']",you too ,fc,MALE,10
['all right.  /'],all right  ,fc,MALE,10
['take care. /'],take care ,fc,MALE,10
['bye. /'],bye ,fc,MALE,10
['bye. /'],bye ,fc,MALE,10
